companyName,company_starRating,company_offeredRole,company_roleLocation,company_salary,listing_jobDesc,requested_url
Kum & Go,3.4,Senior Data Analyst,"Des Moines, IA",$59K - $84K (Glassdoor est.),"Apply business, analytic, and technical knowledge to meet wide ranging business and strategic needs using techniques such as segmentation, statistical inference, visualization, experimentation, and predictive modeling 
Work with large, sometimes disparate data sources to build analytic datasets for analysis and modeling. 
Manage assigned projects from inception to completion with a consultative approach: meet with business partners, define the problem/question, formulate an approach, execute the analysis, create recommendations, and present findings to stakeholders 
Identify and lead implementation of advanced data solutions, tools, or capabilities to meet strategic needs of the organization and enable self-service frameworks for analytic consumers Excellent analytical, critical thinking, and problem-solving skills 
High attention to detail and quality 
Ability to manage multiple projects that are at various stages 
Comfortable working both independently and collaborating in a team atmosphere 
Strong desire to provide quality work while meeting critical deadlines 
Highly skilled with statistical software and programming languages such as R, Python, SQL, and SAS and enabling statistical/data science packages such as pandas, scikit learn, H2O, caret, ggplot, and Spark. 
Advanced knowledge of statistical (e.g., sampling, regression, PCA, time-series forecasting, hypothesis testing, design of experiments) and machine learning (e.g., neural network, random forest, GBM) techniques 
Advanced knowledge of relational databases such as MS SQL Server, Oracle, and Teradata 
Working knowledge of cloud technologies such as Azure or AWS 
3+ years of experience in a similar role 
Relocation to Des Moines, IA area required 
Communication: Delivers clear, effective communication and listens to others 
Conceptual/Systems Thinking: Recognizes patterns, trends, themes, and connections in information to develop innovative ideas and solutions 
Constructive Engagement: Expresses ideas and disagreements, constructively resolves conflict, and encourages others to do the same 
Customer Orientation: Meets the expectations and needs of internal and external customers 
Decision Making: Makes good decisions in a timely manner 
Empowerment: Takes initiative and solves problems 
Talent Development: Maximizes potential and improves overall performance 
Influence: Proactively builds relationships and influences others 
Analytical Thinking/Problem Solving: Accurately assesses problems and effectively and efficiently arrives at solutions 
Strategic Thinking: Understands the current state and is able to visualize the ideal state and how to achieve it 
Passion - We love what we do, and it shows in our work 
Integrity - We do the right thing, even when it is difficult 
Teamwork - We believe that greatness is only achieved in unity 
Caring - We have genuine compassion for our customers, associates, families, and communities 
Excellence - We expect and deliver superior performance",https://www.glassdoor.com/partner/jobListing.htm?pos=114&ao=1110586&s=58&guid=00000186c8a4be3a9dc9a130911e27a8&src=GD_JOB_AD&t=SR&vt=w&cs=1_40a55be8&cb=1678403485660&jobListingId=1008232376713&cpc=64DC0C913FDBAADD&jrtk=3-0-1gr4a9fjejord801-1gr4a9fk4harn800-c1e97b9a618170b7--6NYlbfkN0Ary0qFmdCB0fJzP6yo20VSBnMHiEDzxnbj6p900ThwXbFG10Fys7JX6oTMBjonedWC2cbaQjOF_Q1D8llFZtuBxdK51yfvAPOLkE01xEPtTAlN5DaF5j8x0bONPpDnmsHWonew0ZevUOt1KIV_hHT1PRUA6IIgEHJTzakMw51YMs-rBzwOdMEB_UpEveoxzMltBCCoQAyMyXf9QGmyLLnNTHPxlxkit9f16f3zhYDUkOITewxNgSb6XvvgGFc3rVIsj6XA6qaDq46CRRHxgz4qsKUzKEMuUWX9Ftm1vrHP3wbJlmQ345ueRbumi2fzwYgPTo-fPA69Df1weALTWaA9XoeUGlYCBPiJLfGbzJU1zRvV9qvc0g7yLBHm_9k0lZceYaNbOy93mS2X4gT33TxWSzqjqr7A837fmcdP4ar5BjM_7RZw-pQGMzEKCn1Ylry5N-e5qpNnicreEfQ70NLAmjNzDrgZoMT6leMJQqcbX5USQzJZ5z7HXz5_9RKT1NLiI2bydvFsksc5IRfHH7JGCfi3pw9Eyd2rpxNwjQp3yaHGfR3QEvirOYqZbbJr772t9P88Wo3wmQokTRWWpeY2TX7UMli0La0Ij7iHl7w5OyVz_FmLyxKlvd8d6a4gD9wQdj8-VuRAECJR_WLtXm6GdAbakxP8mxHLUHTlompIHFFWR3zqHbyXc7Csi7lD3zCjEjQWtIrFIsJELtjKLx65sfp-I2oOSZ-D8b7633uyzgX00jEyI9zEmnFch9VFOGR9sIgp7EdvPzo0GnadbGDDbmSB5h06KMEmWFwVIgU0nT3Q0hY9PwMejoIJ1yPc4iUL8maS-TWEhLY5h6Um7asbDkMAL2wKeVQFOCHaWNHp6BOOuPbbwxMq
Beam Inc.,3.8,Data Scientist - Supply Planning,"Chicago, IL",$84K - $120K (Glassdoor est.),"Partner with Global S&OP functional areas (Supply Planning, Commercial, and Fulfillment) to optimize our processes as part of the Global Supply Planning team.
 Implement process improvement initiatives that drive improvements to the metrics and streamline the Supply Chain Utilize a diverse array of technologies and tools as needed, to deliver insights, optimize processes, and develop automation Manage the analytics platform, build capabilities, support global user adoption of analytics and process adherence, develop and maintain technical documentation; work closely with IT for Data Engineering Work closely with the technical community to drive an SAP IBP team of business users globally, allowing for internal problem-solving capabilities, a high degree of end-user acceptance Partner with the business to understand the market segmentation strategies and develop visualization, models using machine learning (e.g. classification, clustering, regression) incorporating ABC-XYZ segmentation, and statistical analysis methods such as time-series analysis, statistical inference Desgin and integrate a global Inventory Management to provide end-to end Supply Chain visibility to Deep dive large into demand/supply planning and supply chain data to explain change, develop insights, and provide business recommendations to improve attainment, adherence, inventory management , and other key metrics. Perform exploratory data analyses, generate and test working hypotheses, prepare and analyze historical data, and identify patterns Lead and mentor a team of data scientists, and analysts Process structured, unstructured and semi-structured data and apply data cleaning Advanced Degree or equivalent experience in Operations Research, Industrial Engineering, Statistics, Applied Mathematics 3-5+ years of experience with at least 2+ years in experience in a supply chain discipline with demonstrated End to End understanding of Supply Chain interdependencies for a CPG or Spirits company. Excellent problem solving, analytical, written and verbal communication skills across many levels of the organization.
 communications and presenting to senior leadership. Experience with S&OP Planning tools like SAP IBP, SAP APO (DP and SNP) highly preferred Experience with Google Cloud Platform, SAP HANA strongly preferred Strong experience with Python/R, SQL, Power BI, Tableau Experience with operations research, statistics, linear programming, constraint programming. 3+ years of hands-on experience in developing and deploying optimization, predictive and prescriptive, machine learning models Ability to use collaborative programming tools like Git Ability to manage multiple projects and prioritize competing requirements",https://www.glassdoor.com/partner/jobListing.htm?pos=102&ao=1110586&s=58&guid=00000186c8a4be3a9dc9a130911e27a8&src=GD_JOB_AD&t=SR&vt=w&cs=1_f7b9c6ad&cb=1678403485658&jobListingId=1008258258056&cpc=DED3C32E22E90A94&jrtk=3-0-1gr4a9fjejord801-1gr4a9fk4harn800-441d6b1b716470fd--6NYlbfkN0CTUQCEalE6IsD6lHWLXDhiQ7NM-E4e5exIdFEWtle2BNmIBy5eeUoQfmFCMBE80xPR3NSK8gYvpAqO_-WEJamx7YXzsFoEGn9CZM-cVDlRMOY67hmFeKmqrbJ3iY9XEoBKIkkMO8mYfEIi3y0wDqcvwVHyGYz4oCf5UtMAUV15oCENe-VH8EE04IfpFA7cjbB9siDN8oU2z-0XYaxTMYV8HGGLmjZ8I_wsOXnGJmctB4tCDQ9Xn0b2NS9BweSXmyNTe6ghNcJZLNGZ3eCHLj8YjuAlLr9belV-qUqQFYwVclTYfCK1nH99bGyVP601LeJqQEJ0VaKLALaWIO7alr28DuRVb5s0D2V1OWZQpu3k7zrcQAQjr2jC7USvdRakyGBHCFVYqv0Cyv4NsfSAtN5wB0qUL5hEnjk49RQr9VgIsKYCaxdTrGEsJB_dRP4q--Odl7DTDYPU_N12y3En-fxts_8NXdszjvlmHbnfI57MlIXIOSDKjGPfVCWABToMmcf-H_xJUIirkgOBbTcB1W6CHVxnWdlpoaacYwm5kwFotGuvas3yKuhle4QQXfXGTe-iAjeJPhaY3toygSSJJm2-gkHyk46f9RNcmXRDV-wK7Q2_LIyuuZ4jJTjcV6PhNwH4uRX_F6MdIi3kKPQ22A3OSNrN9KY3sBOkCJaHmuQu9gDiEtUMjh93fn0l21K79ar1niFQDGvgXt4z52MI7qpJ
Utah State University,4.2,Data Scientist,"Logan, UT",$71K - $108K (Glassdoor est.),"
Clean and transform, data in preparation for statistical and analytical use. 
Apply statistical modeling and machine learning methods to diverse sets of data, and interpret, process, and synthesize results. 
Exercise judgement and prudence when preparing datasets, applying models, and interpreting results, to ensure only accurate and unbiased findings are disseminated. 
Provide accessible, action-oriented insights that lead to improved efficiency and intentionality through collaborative partnerships.
 Create, maintain, and execute a cascading plan of action utilizing large data sets from disparate sources across campus using advanced techniques, such as predictive modeling, and random forests. 
Determine appropriate statistical analyses and methods to employ, based on data availability and project needs 
Identify and pursue opportunities to serve as an emissary for advanced analytics techniques in action. 
Support, empower, and collaborate with institutional partners across campus. 
In close collaboration with colleagues, assist with the preparation and distribution of public scholarship and peer-reviewed data science. 
Serve as a resource for applied statistical methods using advanced and sophisticated technical knowledge. 
Collaborate with program administrators and other stakeholders to develop context around student participation data and empower data literacy. 
Effectively communicate analytic results to both technical and non-technical audiences. 
Stay informed about the state of the field in data science and predictive analytics in higher education. 
Special projects or other duties as assigned. 
A strong interest and aptitude in student success and related data. 
Effective communication skills (verbal and written). 
A technical aptitude and understanding of predictive models and ethics of care. 
An ability to collaborate and follow guidance regarding stakeholder engagement and public communication. 
Equivalent to a Masters degree in Data Analytics, Computer Science, Business, or related technical field and two (2) years of related experience required. 
Demonstrated statistical and quantitative analysis experience.
 Ability to effectively work independently and function as a collaborative team member. 
Exposure to and experience using analytics databases, reporting tools, and visualization tools. 
Proficiency in at least one programming languages (Python, R, Scala, etc.) for data preparation and analysis. 
Doctoral degree in Data Analytics or related field. 
Three (3) or more years of experience processing, cleaning, creating dashboards or other data visualizations. 
Three (3) or more years of experience developing, testing, and analyzing statistical or predictive models in a higher education or educational setting. 
Experience working with large complex data sets. 
Resume/CV to be uploaded at the beginning of your application in the Candidate Profile under ""Resume/CV"" 
Cover Letter to be typed/pasted at the end of your application updated 11/2022",https://www.glassdoor.com/partner/jobListing.htm?pos=129&ao=1110586&s=58&guid=00000186c8a4be3a9dc9a130911e27a8&src=GD_JOB_AD&t=SR&vt=w&cs=1_8cbc16de&cb=1678403485662&jobListingId=1008479399662&cpc=E773D000C9BC26FA&jrtk=3-0-1gr4a9fjejord801-1gr4a9fk4harn800-56bfc5ce53aa6e85--6NYlbfkN0CysDzHxwzSGEmGVRuTgNr8FHm75WqCxlpLF7RWbU4B0kI0qlLnzsnF4Y1RJIW8mGD9Oicg2spRE4lOAysmdX6dBUhoJO9qTEH7rG0ROc1KjXiP8U65Csn2P4ct5goyG3LCgU1uYMQQkMrI-s2bqsM660n6ldmB2uhZrSzpnMeTzZ5CNwF1uC3-ZPleofWQ9jZ3VZnrBWOjvFP7VriKX0nMJTucuG7BHXov-0c0hZoBDdt1X4UjlfkudDSIwSJFv-aCZlXu7G62XQQ6TOi0dCwbskqCQk0t_WuBa-2gwqZHAk6-hLAJdlQCus4JbOirzeUOjY8BXNm38FyOdpOg0f456Jy-E5OxD6PHD3CX6FgT786SsgSZRacwwFefLWArXTVqgxu20INJcIQrRY8pb_lQ04YJwfm3iEA4Y15ntyhg1UTcF_N3MNix9qTKjdlrqo6wl8KwSMSdDMXMAAgtABXz8tZFQ0aLwCEu1K9yCox8mdK6jo0uoiiD2fh1TKyXKdP8M1QkQ9m3vit7aqjQpYRA
Prime Connected,2.0,Telecommunications System Technician (Data),"Providence, RI",Employer est.:$20.00 - $30.00 Per Hour,"Rhode Island Telecommunications System Technician (Data) License. Experienced life stylers who are looking to start a new career opportunity where you’ll work locally for the first year and travel 90-95% of the time afterwards. Service-oriented team members Logical problem-solvers Organized multitaskers Strong communicators Rhode Island Telecommunications System Technician (Data) License. Structured cabling experience working with category cables and fiber optics Open-mind and willingness to learn and understand every aspect of the structured cabling system including pathways, spaces, cabling, testing and more High attention to detail Team player attitude Rhode Island Telecommunications System Technician (Data) License. COVID-19 Vaccination Other vaccinations required to work in hospital environments Must have a valid driver’s license Ability to read, write, and understand English Ability to distinguish colors 401(k) 401(k) matching Dental insurance Employee assistance program Health insurance Health savings account Life insurance Paid time off Parental leave Referral program Tuition reimbursement Vision insurance Monday to Friday Weekend availability Bonus pay Signing bonus Do you have any experience using cable certifiers/testers? Which ones have you used? Do you have experience installing j-hooks? What is the maximum spacing? Have you ever Sweep, PIM, or Fiber Tested before? Are you familiar with firestopping? Do you have any certifications related to firestop? Do you currently have a valid driver's license? (not suspended, revoked, ect.) What cable have you installed and/or terminated in a commercial setting? commercial (non-residential) structured cabling: 2 years (Required) RI Telecommunications System Technician (Data) License (Required) 100% (Required)",https://www.glassdoor.com/partner/jobListing.htm?pos=112&ao=1110586&s=58&guid=00000186c8a4be3a9dc9a130911e27a8&src=GD_JOB_AD&t=SR&vt=w&ea=1&cs=1_5c46ccf7&cb=1678403485660&jobListingId=1008514373420&cpc=22ABB673398E21F3&jrtk=3-0-1gr4a9fjejord801-1gr4a9fk4harn800-bb9696dcc28595af--6NYlbfkN0BgA9iOn_ipWJ9K7MXsIaVBL9m3W-dlHf0GQLKRpbLQUpeethVm2_weUDvKpXtkqgmAEPhs8iK5NTCQfsxXrqhenCkXSjiOGoe8HPt_tNKJ0h9N3S639Qs4pCB4BtaK4fXpD3_yQGWNaQDqLg1xr0UOte-BmNjk1oE-KsrTzHbziiToyDxEqQvpW9Wjk7x6XrGYMiyq4sMnY9XcZTLxGWd9OgxDDUUh7Xd8oovuCf8bfk0GDfhjePlXnN6WOJefwMNNTyEEUaXlNLf7RPld6z96uIDB9DH19Ws3MpruZRxRxD7HaQgmr7F-37EcKQ9mX6GE42SkeBHs2yyyi14vgMaJkcPqOtft_cWlBirYPfYWs_R61atVCZMzq2ETP04IO5h-eRcQAoAlpsoXMZYJVL3RUtLyXvuwKJ7Arw1m__iXUAfKmjCCOCuPM72Wsumfls5GiDYsnX-IPwm_SsDRa6vDIhLLjXDJaMZmS700B7RHyoR4Z_TVhbcKF85mQjCypxeZHc1MZzvMb5p7KDYRn9uyINbDHHsBizmYS0RpdW55aLzznBRjW7qyBWhryo58AeZrdfvuGi-Y46ZYHDCaNFURZgva2p-gYk4%3D
Novateur Research Solutions,NA,Machine Learning Scientist,"Ashburn, VA",NA,"Collaborate with other researchers at Novateur and academia to solve challenging scientific and operational problems in machine learning, computer vision, spatiotemporal data modeling, and related areas. Develop mathematical models and implement novel algorithms that leverage and enhance the state-of-the-art technologies in · machine learning, spatiotemporal data mining, computer vision to enable smart systems. Write research papers and present results. Help identify new research directions. Masters or PhD. Degree in computer science, engineering, physics, applied mathematics or a related field. Efficient and scalable algorithm design and problem solving skills. Hands-on experience and proficiency in software prototyping. Innovative researcher with passion for working on cutting-edge technologies. Ability to work in a dynamic and fast-paced environment. Team player with positive and collaborative mindset. Excellent written and oral communication skills. Strong record of research publications. Our current focus areas include geospatial and spatiotemporal data mining, largescale microsimulation, medical image analysis, computer vision, and knowledge-based reasoning. Prior research in one or more of these areas is a plus. 401(k) 401(k) matching Dental insurance Employee discount Flexible spending account Health insurance Health savings account Life insurance Paid time off Parental leave Referral program Relocation assistance Retirement plan Vision insurance 8 hour shift Monday to Friday Bachelor's (Preferred) Python: 1 year (Preferred)",https://www.glassdoor.com/partner/jobListing.htm?pos=105&ao=1110586&s=58&guid=00000186c8a4be3a9dc9a130911e27a8&src=GD_JOB_AD&t=SR&vt=w&ea=1&cs=1_1b84b001&cb=1678403485659&jobListingId=1008104107052&cpc=D99DB9A39DE67464&jrtk=3-0-1gr4a9fjejord801-1gr4a9fk4harn800-77e9072776e0640e--6NYlbfkN0A1UtxlOJl6Y6F02-oTF9zwI-Nb9Dq9qDYX5XseiH9toUfXu3a75OfVg9vFsqgscdNWuA9QSsgLggEpbZOeGcgjoCNh6IyjuwII5gDY3c2uZXeJk0mDPN-fbvUQ6DFMH4Stj-AGiFz8UXPNAgeka_JN86_Ydem9U3K0ukw3cbplsXx0A8oMBmyTyDVOvj0o8RjrZHAFfh71HmF7dpiUxSL7GYs7Rs_thIhhACqZBFA0VmVDInsbZI9RBKoQRs3Q1jH_k0EM-rSPsI6uWGrJX_bTJX-t1G9GEBAAFcEcwyTr3jZB3dBHexMv3KbOeSYM4j5LH0UUmG9x3FsJcP0JJmRvTz4Z2NmhUiPGp5-pRfBLmB95HB8LGNYn5ycyxljU4aqn5JRCOTbMK-uHsqC1E9iyS-kLOb7Hei4AmFPUm110eVM4JlQYkz5QsaJmnowBvLhtjtjdvaAL_aT0YGPBTZJON5ESobjYya-JJiQlRh5N4h8O58_uI1VbEblo8-qeP7uvXmRtXkYrjWhz8ibfExZPW_Rl0BufG69UE02vYTecoVcFAp7ttRtAn8xE83XPLbt72Smqz-_Ii8AAP8-J7bYZKHtD3o9KLM4%3D
Bloomberg Industry Group,3.6,Data Scientist,"Washington, DC",Employer est.:$110K - $130K ,"Proactively explore, research, describe, and analyze data. Develop tools and strategies related to text analytics, machine learning, and semantic enrichment Develop and maintain strong working relationships across departments and with key partners and stakeholders. Be tuned in to market trends and emerging technologies to find innovative solutions. Learn cutting-edge research in advanced ML & NLP topics and devise an efficient application for projects. Take ownership of technical solutions and direct machine learning strategy for the team. Drive, design, and develop projects as the principal point-of-contact, with the ability to determine suitable ML models, direct feature engineering processes and negotiate KPIs per business needs. Participates in special projects and performs other duties as assigned. Bachelor’s degree in related field or equivalent experience. 5 years of experience working with large data sets and managing data projects. Experience with programming in Java, Python, SQL. Experience with distributed computational frameworks (YARN, Spark, Hadoop, Kubernetes, Docker), cloud-based computingApache Solr, Lucene, or Elasticsearch). Experience with managing diverse data sources, including preprocessing, cleansing, and verifying the integrity of data. Experience with working with state, federal legislative or regulatory data is a plus. Familiarity with SQL and NoSQL data modeling and exploratory data visualization, preferred. Knowledge of advanced concepts such as weakly supervised learning, reinforcement learning, and deep learning, preferred. Extensive knowledge of leading open source data analysis tools, ML libraries, and NLP processing techniques (including topic modeling and summarization). Knowledge of descriptive and inferential statistics, regression, multivariate and univariate hypothesis testing. Excellent understanding of ML algorithms (e.g. KNN, Naive Bayes, decision trees, ensemble models, clustering) and the ability to select best methods for a business problem. Ability to analyze and manipulate unstructured and semi-structured data (text, PDF, JSON and XML files). Experience working with REST APIs (actual REST API development is a big plus) 401(k) 401(k) matching Dental insurance Employee assistance program Employee discount Flexible spending account Health insurance Life insurance Paid time off Parental leave Professional development assistance Referral program Tuition reimbursement Vision insurance 5x8 8 hour shift Monday to Friday Bonus pay Washington, DC 20005: Reliably commute or planning to relocate before starting work (Required) Python: 5 years (Preferred) SQL: 5 years (Preferred)",https://www.glassdoor.com/partner/jobListing.htm?pos=130&ao=1110586&s=58&guid=00000186c8a4be3a9dc9a130911e27a8&src=GD_JOB_AD&t=SR&vt=w&ea=1&cs=1_b7240f2c&cb=1678403485662&jobListingId=1008333856762&cpc=82B3195DA92CAF92&jrtk=3-0-1gr4a9fjejord801-1gr4a9fk4harn800-78a8d34089bdcbe1--6NYlbfkN0DQJVj3nE-ojcde6j17RFH5ufg4E4jejBl_AArWOANfmZ4ILct6WL_RUT8XTtyTCRwD_nsug0Qtdj-h3ENmNM1m1sr7at_ap0b6ddrutVbhzdSbnh57EJ9wbOUVYen1L7LXHGB9hQR7Yozx9o3y_pPUQm6WU6TuvAequ6LilHXu0Kv7Rf2nNbYNxsslZx_8GJbLiQJ2sDiu1Q2IC8vZyOSsgj0IweglreandUYvnew10E0ga4vFjaWERtuUbQVVWWMCQqimQf43LXuCwD-el-6VrQgWmyqgsIsAq6pFXfs_KGOJFepZZ88ex-yqpO2J7-zFBR8bkHPOf89OX7TxOb8mLAXfJ48gmCWCoXFqUaWJtu9azpa3nIkJGT9xaW41W1EzsswkgNIHhLwaugU_rlwu0pIf1DyxfRlneGzuPZ23-XqRw731TxR5IiCjyLU2YBpVz14gVkyryQ0Kz89t8r5aYifnMEdZqlIN6FHkmlD__OM2Vdhcan7C8qp-BpzEQcen4OJGCD-YDpal72o0Nu_wHmwVbPK1DHS9-1WNtc8oZ01LVXb7yPWvNPzT6-dwvgg%3D
