companyName,company_starRating,company_offeredRole,company_roleLocation,company_salary,listing_jobDesc,requested_url
Hamilton College,4.5,Data Science/Analysis Research Librarian,"Clinton, NY",NA,"Actively participate in supporting diversity, equity, and inclusion in the Hamilton community. Provide research support to the Hamilton faculty and students in the social sciences, members of the public, and the larger scholarly community. Collaborate with faculty, educational technologists, and other academic partners to provide instructional design support and promote digital and information literacy in the social sciences and across the curriculum. Serve as primary liaison to assigned academic departments, programs, and academic resource centers. Participate in the ongoing training and mentoring of the R&ID student tutors. Build collections in multiple formats to support the academic goals of the college. Maintain and apply a current awareness of best practices in teaching and learning, especially as related to data analysis and digital and information fluencies. Develop and maintain library resource guides for faculty and students. Engage in a variety of professional development activities. Participate in other duties and responsibilities as assigned. Uses advanced skills with data analysis, data cleaning/wrangling/normalization, regular expressions, web scraping, and APIs to support and collaborate with researchers on data-related research. Retrieve/manipulate complex data from a variety of sources; transfer data between platforms for use in multiple computing environments. Work closely with and provide direct assistance to students in data science/analysis including workshops or other instruction. Assists with in-class instruction of statistic-based labs in the social sciences. Assist students with research projects and course assignments that require data analysis. Works collaboratively with others in LITS and with LITS partners such as the Quantitative & Symbolic Reasoning Center (QSR), Oral Communication Center (OCC), and the Writing Center. Assist in the choice, application, and interpretation of quantitative research methods, and with the use of statistical software needed to implement these methods. Works consistently to enhance technical skills and develop proficiency with new data analysis tools and techniques. Develops services in response to needs of faculty and students in the social sciences, LITS priorities, and diverse Hamilton populations. Build effective working relationships with faculty and students. Identifies, evaluates and recommends new and emerging data analysis research tools and methods for social science students and faculty, and LITS. ALA-accredited master’s degree in Library or Information Science, and/or related advanced degree in quantitative social science; extensive coursework in economics and econometrics. Equivalent combination of education, training, and experience will be considered. Experience conducting social science research at the graduate level. Experience providing data-related services in a library or research setting, either one-on-one or in a classroom setting. Intermediate to expert experience with R and STATA; experience with SPSS and SAS highly desirable. Proficiency with at least one programming language (such as Python or Java) highly desirable. Demonstrated advanced data skills, including data cleaning/wrangling/normalization, using regular expressions, and web scraping. Knowledge of software and tools supporting the discovery, management, analysis, and visualization of research data; including keeping abreast of current and emerging trends. Proficiency using tools and programming libraries to support text analysis. Experience working effectively with a team to plan and complete projects. Demonstrated ability to work with diverse populations as well as demonstrated commitment to diversity, inclusion, and accessibility. Demonstrated ability and experience functioning successfully in a fast-paced environment with a strong service orientation. Ability to work collegially and communicate effectively with colleagues, faculty, and students. In-depth knowledge of a wide range of information sources and technologies, especially data science/analysis. Superior teaching skills. Curiosity about how technology is affecting research and teaching, and enthusiasm for collaboration with faculty and students in a liberal arts context. Excellent writing, problem-solving, and presentation skills. Demonstrated aptitude for quickly learning new tools and technologies.",https://www.glassdoor.com/partner/jobListing.htm?pos=325&ao=1110586&s=58&guid=00000186c8a6da6a8b3d5f366ace7dc5&src=GD_JOB_AD&t=SR&vt=w&cs=1_a65736c6&cb=1678403623987&jobListingId=1008445231183&cpc=022796DF6CE1C9E6&jrtk=3-0-1gr4admkak270801-1gr4adml1i38m800-0bb0f758b9f7dc46--6NYlbfkN0ATKcDG7uKu-HzE7G0Rbx-rO7IixqtbOcMq1Ypzrxa53ONfJFcpPAwiFJ8YNQL-_Ny-b-caHq3Monw5lX2ArcBsTFU53jDltiMwCceJ7opqHT0v9XHFQF2MbgcI3DhFWVpVkSfm9qnQIwx6deCdwpXuZjpJNdDjoL9iAlaoiNkW2_LjLTJjzonB-BWbjoBns-Jmea8p-J4Hxf7hhh_Es6ThDMldSRUmDy-7nUUfipw7RUkH_RyyxXp7yMsBJBP0-blfY8HoUS67FrukwJBLGkQSSzKwWXVsTWnRrK16XvPyud9y_pe10F6KFnvAucYMGnxXTvIyHnk_-VwwnW85gcEqD_c75pclhgegn1wuzBX8RbLElEwfyUfKGI_Q-D-FnY_teBMi24L6_Q2dkthCqJu_oLusfHHW1GPITxNDqipuM-xNmnF4ifGIjJ6h6lAAXzILIGoZhjk4E6j9iJP-qcnQD56-yqBiNvDudu5QDDQ90coeLFQAJLnDcdFirz2k1nHlgkF_fxfT4XMOlh9KZ9CrWf-YBvSTTsjHQWXvNxBw4w%3D%3D
Houston Independent School District,3.3,Senior Business Systems Analyst - Data Analyst (IA),"Houston, TX",Employer est.:$76K - $126K ,Dental insurance Health insurance Paid time off Vision insurance Yearly pay 7 years 8 hour shift IT: 4 years (Required),https://www.glassdoor.com/partner/jobListing.htm?pos=323&ao=1110586&s=58&guid=00000186c8a6da6a8b3d5f366ace7dc5&src=GD_JOB_AD&t=SR&vt=w&ea=1&cs=1_c8cb0a18&cb=1678403623987&jobListingId=1008360957936&cpc=52D3555E595CCC3C&jrtk=3-0-1gr4admkak270801-1gr4adml1i38m800-474f8b9c59dc751c--6NYlbfkN0D2YumZEHoIhERAeMyr7HJwwTpxKWptLEMcsiSkRytksH30Lnc4yOxPDRuKizLS_mj4sztWVgPO1nDllVzH7tQNBbbtVCXY349aqr2aO-m_qQAYDFNn3swQxki1X8N9492NZOj3WZBWMeJ6laGTh5S0EBNs3Z3kajlpGZ6eSBOb97fm8d8TEJxSYnGOKYuYyMDtUH8nTPDSvCoYCLPUzww3m-rGoAMrogYPXQUnW2O3iDnBKpm4avMS_-KP8f7ecfgqh6ucgYvWz9tH_PgqGGcJqZRQXZYw-EyQii0_ZsAz0esbvced3HYefXVZEc9oT1TJs4eLmjmCkzURwkcDh20UWblRUcyYB4k1hswWqY7IAJHGwjpDskrvP8g_4a5Vn2fZ97xbd1Ppf1OBaBHe0koRdysX5GEW0NKi71ccxdfkkANZoHwjZrVK59oy7UCv9k53jt5Zb1KNLbAbJVofqvzPRPgr0hcPtcTF3wpGzVxZsK5puLIPNT2riGZlZaiAHNFwlqPVrCFNDpiF7VHDtWOziokubsFmcSpv8oP_i7oyBSnPgiiy82E7G5JZoynOa0aaepnobozG9-_EM1lfHVuGTf09kleFVeSVodiR-LbcuasUcxL-YFHRa-dqvj3lUwJHy61JbDeorw%3D%3D
Navy Federal Credit Union,4.1,"Data Scientist I/II, Strategic Planning & Forecasting (Contact Center Operations)","Vienna, VA",Employer est.:$86K - $146K ,"Military Times 2021 Best for Vets Employers WayUp Top 100 Internship Programs Forbes® 2022 The Best Employers for New Grads Forbes® America's Best Employers Newsweek Top 100 Most Loved Workplaces Fortune Best Workplaces for Women Fortune 100 Best Companies to Work For® Computerworld® Best Places to Work in IT Support the delivery of strategic advanced analytics solutions across the organization with solutions drawing on descriptive, predictive, and prescriptive analytics and modeling Leverage a broad set of modern technologies – including Python, R, Scala, and Spark – to analyze and gain insights within large data sets Manage, architect, and analyze big data in order to build data driven insights and high impact data models Evaluate model design and performance and perform champion/challenger development. Analyze model input data, assumptions, and overall methodology. Using statistical practices, analyze current and historical data to make predictions, identify risks, and opportunities, enabling better decisions on planned/future events Provide analytics insights and solutions to solve complex business problems Apply business knowledge and advanced statistical modeling techniques when building data structures and tools Collaborate with other team members, subject matter experts, pods, and delivery teams to deliver strategic advanced analytic based solutions from design to deployment Examine data from multiple sources and share insights with leadership and stakeholders Transform data presented in models, charts, and tables into a format that is useful to the business and aids in effective decision making Point of contact between the data analyst/data engineer and the project/functional analytics leads Develop and maintain an understanding of relevant industry standards, best practices, business processes and technology used in modeling and within the financial services industry Identify improvements to the way in which analytics service the entire function Recognize potential issues and risks during the analytics project implementation and suggest mitigation strategies Prepare project deliverables that are valued by the business and present them in such a manner that they are easily understood by project stakeholders Perform other duties as assigned Master’s degree in Data Science, Statistics, Mathematics, Computer Science, Engineering or another quantitative field, or related field, or the equivalent combination of education, training, and experience Skill interpreting, extrapolating, and interpolating data for statistical research and modeling Advanced skill in Data Interpretation, Qualitative, Quantitative Analysis, Python, R, and/or Scala Moderate skill in SQL and querying (able to pull/transform your own data) Ability to understand complex business problems and determine what aspects require optimization and articulate those aspects in a clear and concise manner Advanced skill in communicating actionable insights using data to technical and non-technical audiences Proven experience working in a dynamic, research-oriented groups with several ongoing concurrent projects Demonstrates functional knowledge of data visualization libraries such as matplotlib or ggplot2; knowledge of other visualization tools such as Microsoft Power BI and Tableau Ability to manipulate raw data within visualization tools to create effective dashboards that communicate end-to-end data outcomes visually Proficient in storytelling with data skills Exceptional technical writing skills Advanced skill communicating thoughts, concepts, practices effectively at all levels, adjusting as needed to a target audience Advanced verbal, interpersonal and written communication skills Advanced database, word processing, spreadsheet, and presentation software skills (e.g., Microsoft Access, Excel, PowerPoint, etc. Moderate skill in descriptive, predictive, and prescriptive analytics and modeling; demonstrated success in building models that are deployed and have made measurable business impact Experience in using two or more of the following modeling types to solve business problems: classification, regression, time series, clustering, text analytics, survival, association, optimization, reinforcement learning Working knowledge of advanced techniques such as: SMOTE, dimension reduction techniques, natural language processing, sentiment analysis, anomaly detection, geospatial analytics, etc. Demonstrates a deep understanding of the modeling lifecycle Moderate skill data mining, data wrangling, and data transformation with both structured and unstructured data; deep understanding of data models Understanding of data models, large datasets, business/technical requirements, BI tools, statistical programming languages and libraries Familiar with Data Engineering concepts Familiar with the use of standard ETL tools and techniques Familiar with the concepts and application of data mapping and building requirements Demonstrates a deep understanding of multiple data related concepts Familiar with Data Integration, Data Governance and Data Warehousing Moderate skill in Data Management, Data Validation & Cleansing, and Information Analysis Doctoral degree in Statistics, Mathematics, Computer Science, Engineering or another quantitative field, or related field Working knowledge of Navy Federal Credit Union instructions, standards, and procedures Familiar with project management concepts and frameworks such as Agile Frameworks (SAFE), Communication Strategy and Management, Delivery Excellence and Requirements management",https://www.glassdoor.com/partner/jobListing.htm?pos=306&ao=1110586&s=58&guid=00000186c8a6da6a8b3d5f366ace7dc5&src=GD_JOB_AD&t=SR&vt=w&cs=1_5046f109&cb=1678403623985&jobListingId=1008519721278&cpc=AE9F6614D4EC1B58&jrtk=3-0-1gr4admkak270801-1gr4adml1i38m800-7baafea093008735--6NYlbfkN0C1zplEsFktHkQc7kOOwm4rInMAlFzAoLIRfcwaDPIGgu8jCB8VseTUYObc-C-PZ6i6kRtt0OaNYY8IuoZAzd4ddlAnuSuZ-2xuJcHTVj19Hx1QAFxwzOD8w6w-1V86k9nJCORthB0EfYgjcQEePIxIVuJARluAAZ3HbKfvUMfcpMjzcCuhA6HNmtP8pcUTSYvxab7J0xVYF0X_PaJNONd3CrBOc0h_JJvqCgxwh4W7Qfdx-ZuX5q3r3-WLEhIqLXh0521Y-eCD8NpuKdSFYhSz6Zd9QQtBOXKDesjp3EnkBtjyyiLdRI-7QrucAanMRuLrXjWnx8cWxMuIv3LLU0gyEeYWl2ivaTxOCnHe4MiqpOLEUuA9DHJGyNnBU1bILZZjRemxOA4wCm5TkAdSokl1aaPdxAQCrq356y2r5GPNuWkDTRoYxgfmeDMXj8awEtpye4PTLQayMB8Ys8Wq6MFsgQQcpyB4aLR7parjDUtF47mY1HEypdLMf3tPlqGFivHo7L3c9puMXyC6eCqkAWcEmkzZtS2DpZeZCF1Nk5HQCF6xBI-7Lf4nWyqiiHyxv_9l-xKSbmvOY4m7vmghBkV8x8kXlHsEyD0FN77kHNllRFwDL1qOoSBDrddSGDl5uIoBerBN0-kqMQr573cnrrzrk_KUkHw4pNBAUL9KHkN-q4qJPswgwiNQurD9gIbMN-phP5Ft3m5ZQlvgzhdzYUdatdlVLCrr_K3qa_9oaZ4riksM3HR4anIAxAaDAFDpoC4h4tYbW0jtcIsTZvXXpBKs4BfqKnTrzDNd3xrr6WDn_A%3D%3D
"Daiichi Sankyo, Inc.",4.0,"Associate Director, Statistical Programming",Remote,NA,"
Supporting project lead on outsourced projects, act as statistical programming subject matter expert (SME) to support outsourced programming activities and be responsible for the programming technical decision. By guiding other internal programmer or by self, perform programmatic review of Study Date Tabulation Model (SDTM) and analysis (including Analysis Data Model (ADaM)) datasets as well as TLFs generated by statistical vendor, ensure correct and effective vendor programming implementation, and expedite the preparation of regulatory submissions. Responsibilities include: make strategic programming decision and planning, review Case Report Form (CRF) annotation and SDTM dataset, identify data inconsistencies and support data review, review analysis dataset specifications and ensure correct interpretation of SAP, develop independent programs to validate stud level analysis dataset and TLFs generated by vendor, ensure analysis dataset in compliance with CDISC and submission requirement, review study submission data package and ensure its quality and integrity. 
Provide hands-on statistical programming support to regulatory submission and help submission team in quick turnaround in response to regulatory agencies. Responsibilities include: develop programming submission strategy, perform integrated analysis of efficacy and safety, generate submission data package, create TLFs to support submission Q&As, perform ad-hoc and exploratory analysis requested by clinical team, and support agency response or potential Advisory Committee Meeting 
Develop DSI programming standard template on datasets and TFLs to improve efficiency and quality. Responsibilities include: contribute to CRF and SDTM standard development, develop, implement, and maintain SDTM, ADaM dataset and TLF standard, develop sample programs to generate and validate SDTM, ADaM dataset and TLFs, support technical training and ensure effective implementation of SDTM, ADaM and TLFs standard in clinical trial data analysis 
Develop and maintain necessary programming macros or tools to effectively support all programming needs. Responsibilities include: identify the macros or tools that will facilitate programing efficiency, lead the macro or tool development by working with contractors or by self, and support the macro or tool implementation and maintenance 
Evaluate, assess and enhance DSI computing environment system. Responsibilities include: continue assessing DSI new computing environment system for programming and analysis efficiency, identify system bug/issue and lead the activity to enhance the system, develop system training materials and work as the SME to support implementation, evaluate, request and approve system upgrades, and propose/develop system utilities 
Bachelor's Degree from an accredited institution in a technical field such as computer science or mathematics; preferred 
Master's Degree in biostatistics preferred 
10 or More Years proven experience within pharmaceutical industry, or CROs supporting statistical analysis of clinical trials programming preferred 
7 or More Years proven experience within pharmaceutical industry, or CROs supporting statistical analysis of clinical trials programming with Masters degree preferred 
Previous experience supporting SAS macro and/or system utility development preferred 
Advanced working knowledge of all aspects of the SAS programming language used in clinical trials programming preferred 
Advanced working knowledge of CDISC SDTM and ADaM, and extensive experiences of their implementation in clinical trials analysis preferred 
Advanced understanding of statistical concepts in support of analyses and reporting of clinical trials preferred 
Knowledge of all phases of drug development, including early and late phase clinical development and submission preferred 
Solid background in applied statistics preferred 
Solid knowledge of new advanced statistical methods using SAS and R preferred 
Advanced knowledge in database structures and set-up preferred",https://www.glassdoor.com/partner/jobListing.htm?pos=301&ao=1110586&s=58&guid=00000186c8a6da6a8b3d5f366ace7dc5&src=GD_JOB_AD&t=SR&vt=w&cs=1_9738468f&cb=1678403623984&jobListingId=1007921243564&cpc=DEE3EB0998C5D2D4&jrtk=3-0-1gr4admkak270801-1gr4adml1i38m800-8ed96555afce0d09--6NYlbfkN0Bw7gFhdLXEzndZGDRRPeG4jcKd-yfMNlJaYFW-WjZVmieLT7eHUqNAondQNcPB_GB10Wse3M7Q7uRCKIGPIV_FvbvPLX1FprhOa9pRetDz7eVib83w4Shu8lRMlwifTAFu29Wu3328z21lu4QX3PWy-qTIrmpbzJAraUz4yEycZ-BfaEyy-LDGXHrNrKYV9CRa9hRYbw6THgerUL51TvT1GxyEbmdG0Y9ydefiJ-hNxfHLfuPD1pBcWEocDr6s-I7ViOvAOjPBbtYJWhX03b4u3zyQzM5-ltLlEM51XJunDdbhdkSPEpjeByghXjxM49jCVkKWCzUjATffyGqSybOcBdj5yX9bQ2KI03fpij-chCPbd1BOk_1eALyuCIxTMBcZjXy1oOIMtzFfKx9ItOAxKifcpfKCdpRu5MuU-5ZsyIXDVtEwrkq1HtqQiCRDIflvN5-hL9zi-3-_D7ffc-mTYZPZCF_ViYWRTO6HwlGqEKSUP0BVQU9suQfrxP1u2iMRJowCDZ2FcWxiVSBm34ACL7BGwRLb_aS77_Tfrtg9QN6gIVYQu9ASuKb_AA9bSTVhshXAAor3lDXP8q4bRmDc-I-qqT_eX_bD-w5AOBk8BttxEdlh89FqmdFjtd46PB8nYiQJ1nyFbvkhfYE64Fhc-XQO5NMZwp3o6DQNJeMjnCsL5iKPC_ZH
Priority Plus Financial LLC,NA,Data Scientist,"Costa Mesa, CA",Employer est.:$106K - $114K ,"Use an ensemble of decision trees, Naive Bayes, KNN and SVM to create a unifying model. Use Dirichlet multinomial distribution to initialise the model. Perform cross-validation to check the robustness of the proposed model. Learn multi-layered perceptron using radial basis function in order to compute the posterior probability. Use Support vector machine to make predictions. 401(k) Dental insurance Employee discount Flexible spending account Health insurance Health savings account Life insurance Paid time off Vision insurance 8 hour shift Monday to Friday Bonus pay Costa Mesa, CA: Reliably commute or planning to relocate before starting work (Required) Python: 1 year (Preferred) SQL: 1 year (Preferred)",https://www.glassdoor.com/partner/jobListing.htm?pos=312&ao=1110586&s=58&guid=00000186c8a6da6a8b3d5f366ace7dc5&src=GD_JOB_AD&t=SR&vt=w&ea=1&cs=1_c391fd30&cb=1678403623985&jobListingId=1008519813989&cpc=545C0D17DAD7ABB7&jrtk=3-0-1gr4admkak270801-1gr4adml1i38m800-7c4af0927c11718a--6NYlbfkN0Bi-g4OEguhQEx4pjzkmulzkFDPdVMQm6g82nLRMcVRUO51G8Q5x6ijh0twV98zUMPsh4HarxxBS1DecFqT-_iu_-Ngn-P7FV0POxZQumVEp-yq2hf5_l5g4uSXFfidNomeugHvKevK7QQV0g_vnhhzlelJ6N1Io0nbWIQM6X8V9_gOAx_IBgQ2BX9Ct5ImhQLf8NvhJV2jvUwu4W3rmsoLKbSIcunin3eYRRmBveyNO_vuVlOetFjU_hp9x6dE2jk2BE04lmLgs-cfx9jVx3XwIrbiqaxb2XThyJXGb6eK_RaPqMqn-z2Dk408_rkBL0b4Fb4c5fr1oVlLOq0QYBjN00NRQyME5E8DfND41APw6twWtKGJuQ2RUhmAdjzWJ2tJ7BOm8egKPXgDLMh9TaqhHGjFK8B-tpfLCjIPLuTBPc8Ew4TWAd4RkcO5KD5YGv10JOZZCe-sU_1024k_kacrj7HNWz8bOXGmL2yfy8iPGAY-gzkTpB-FzCmLyYHs7dbRinKTFNcdyg_wNs7WbzvUjytPfGm8lVeZ3Jt8GSAouLiWTikalCEBCzgos_M_LZXk2XQwK1oLqHNve9JYOrg-
Society Insurance Company,3.8,Senior Regulatory & Statistical Reporting Analyst,"Fond du Lac, WI",$69K - $94K (Glassdoor est.),"
Researches, formulates, and communicates simple-to-moderate data for statistical and regulatory reporting solutions. 
Assists with data call requirements/filing forms for regulatory agencies and/or state insurance departments. Ensures required data is reported to reporting bureau accurately and timely and recommends corrective action when required. 
Oversees statistical reporting to bureaus such as National Council on Compensation Insurance (NCCI), Wisconsin Compensation Rating Bureau (WCRB), and Insurance Services Office (ISO) to ensure compliance. 
Serves as super-user of statistical and regulatory agencies/vendor products to assist with compliance reporting. Works with vendors that provide services for regulatory reporting. 
Stays current with statistical manuals, bureau filing requirements, statistical plans, data requirements, and regulatory reporting items (i.e. advanced knowledge IAIABC). 
Proactively monitors regulatory reporting processes for upcoming change impacts. 
Assesses, communicates, and collaborates with Business and IT regarding regulatory change impacts/product impacts on business & regulatory reporting transactions. 
Identifies opportunities and recommends data and reporting initiatives that support corporate strategic plans, goals, and objectives related to regulatory reporting. 
Assists with investigating and using pre-editing programs to identify and resolve errors prior to submission to regulatory reporting bureaus. 
Builds, maintains, and distributes compliance reports for management review. 
Acts as a subject matter expert to IT for system programming to develop/map reporting fields or when programming impacts statistical reporting. 
Manages data reporting for statutory and regulatory data requests. Communicates with internal departments regarding data issues with input errors or incorrect interpretations of policy coverage, data, and regulatory reporting solutions. Identifies and recommends changes to automated systems to comply with reporting requirements. 
Develops, writes, and participates in testing scenarios based on analysis to business process or product changes. Participates in investigations and resolution of fines or inquiries from regulatory reporting bureaus. 
Assists in the design and development of new reporting processes and trains staff to maintain processing once implemented. 
You enjoy using logic and analysis to solve problems. 
You are curious and enjoy seeking additional information – always asking the “why”. 
You enjoy brainstorming and can deal with concepts and complexity. 
You are a self-starter and enjoy taking a lead role in improving products and services. 
You are quality-focused and seeks ways to implement best practices. 
You are organized and can manage multiple responsibilities. 
Associate’s degree in business or related field. Equivalent industry experience may be considered. 
3+ years of Property and Casualty insurance industry experience. 
Knowledge of commercial P&C insurance products and insurance department requirements and processes. 
Strong communication, analytical, and problem-solving skills. 
Prior experience with statistical plans, edit definitions, and submission processes highly desirable. 
Prior experience with ISO, NCCI, and independent state bureaus and analysis of circulars, regulations, and statutes highly desirable. 
Comprehensive Benefits Package: Salary with bonus plan; health, dental, life, and vision insurance 
Retirement: Traditional or Roth 401(k) Defined Contribution Plan PLUS Profit-Sharing Plan 
Work-Life Balance: Company-paid holidays; flexible scheduling; PTO; telecommuting options 
Education: Career Coaching; company-paid courses; student loan and tuition reimbursement 
Community: Charitable Match; paid volunteer time; team sponsorships 
Wellness: Employee Assistance Program; health club reimbursement; wellness reimbursement",https://www.glassdoor.com/partner/jobListing.htm?pos=319&ao=1110586&s=58&guid=00000186c8a6da6a8b3d5f366ace7dc5&src=GD_JOB_AD&t=SR&vt=w&ea=1&cs=1_8f69a98f&cb=1678403623986&jobListingId=1008514954701&cpc=75A994F6883660E9&jrtk=3-0-1gr4admkak270801-1gr4adml1i38m800-db948a75aebee38d--6NYlbfkN0DUnBXLrXp8zppNpWJLnz9frjyHX-SHmLuucPCO4lf10Hues_2hfHc_x8_ihJPqG8toK-bByzDpLf47iSeBw9Boh_M9Fp-OkIrUc9DfZmEOCUIuaDLoUS-Tv4wJAvdDfQYq9nefhEskCosUxyN2GeR65sXHWuem4ZcizlX5Lia5jCKB9vql5QeVRx9JFLQLWqCmFkB1MYR4rBzmBBsPr1gCMKZTyjRcT37_U8tzIuyApbnhWzJGS9XXJ5TBEwgsS8zJHglrQHxLS1D-Q6dCCY85r4i77miQXWGa1fUTlow0NsEtD5W7UN2v2hhOcWFqKhzV_IrcXgI5066w5VS6RxLTHlnUwveph2WdWsiZ02Hfw6Y_N9qVbso_FkYssFHbrLLw3I7VGREvuiyRLYg_X3975wxkrLv9w2piLVmgvbEb1QBHzeA7ns8lqvAWT6mSMtBDoS1WOQQtF9ywNxJxsJhGwpDuqakBfhsMTKTvmJRtZig2KKu0TC1W2C8N7RRs_rDm7MjtSeBfiURN2LUO0HhnZ_Ccqv38GzpTZQaIi9IAbruROat8Lp2crjfKQq1TjyG3AEI9gjQTw1ocwcA5tWfw5M_0KiaoZcB-31Mb-mvcIQ5WyArQEqJ03opM8lSl8DXVaBwhV-GTR6y8BmNke5xblG16hRsd_iyXc88FvmO4FoMYwB8SEKzc00-IKH9NL2V0hIJ7N-lNEVQU81tPsAcyEuXvFhGvd6YS6WRZKaIvGH4NGXOyJVjKqtYSCKtHxcN6OVlWGisdHvCydZFHOXZ9kTXKYTj4OZYRZaXiIdr5HWQSdUrpBvjhnq1gU2oTmKpKh7Z4VRB8Ig%3D%3D
