companyName,company_starRating,company_offeredRole,company_roleLocation,company_salary,listing_jobDesc,requested_url
CACI,3.9,Data Engineer,"Fort Bragg, NC",NA,"
Must meet DoD 8140 IAT Level II or IAM Level I 
Ability to assemble large, complex sets of data that meet non-functional and functional business requirements. 
Identify, design, and implement internal process improvements including re-designing infrastructure for greater scalability, optimizing data delivery, and automating manual processes 
Develops and maintains scalable data pipelines and builds out new API integrations to support continuing increases in data volume and complexity 
Works with stakeholders including data, design, product, and executive teams to assist them with data-related technical issues 
Able to migrate workloads to, from, and among the different cloud computing service models. 
Able to Identify data consolidation opportunities across database systems, including data sharing and access between business lines. 
Provide recommendations on new database technologies and architectures. 
Monitor and maintain databases to ensure optimal performance. 
Implement data mining and data warehousing applications. 
Writes unit/integration tests, contributes to engineering wiki, and documents work 
Designs data integrations and data quality framework 
Designs and evaluates open source and vendor tools for data lineage 
High-level of proficiency in SQL, data modeling, and ETL/ELT processes and implementation 
Ability to obtain a DoD Secret security clearance 
Technical Documentation Skills; familiar with multiple databases 
Knowledge of programming languages (e.g. Java and Python) 
Experience with AWS and open-source data engineering solutions for big data 
Familiar with data engineer tools like Apache Airflow/NiFi 
Experience with non-SQL database and data engineering problem sets ie. noSQL, vector, graph 
Can effectively communicate with Data Science Teams and Software Development Teams 
CACI-Wexford manages the Special Operations and Asymmetric Solutions Operating Group within CACI’s Operations Support and Services Sector. As the premier provider of Special Operations capabilities; Tactical Advisory and Embedded Support; intelligence Applications to Law Enforcement; security cooperation and OCONUS Training Support Delivery for the company, CACI-Wexford has a reputation for uncompromising standards of quality in its people and its performance. Joining the CACI-Wexford team is a mark of excellence for those employees who complete our rigorous Mission-Focused Staffing process. 
CACI-Wexford ’s mission places its personnel against the government’s most critical emerging challenges. Work with us, and you’ll be working with a team making a difference across the globe. 
CACI-Wexford offers competitive benefits as well as numerous learning and development opportunities. 
As the Prime Contractor for this effort, CACI-Wexford offers unmatched stability and growth potential within the program.",https://www.glassdoor.com/partner/jobListing.htm?pos=109&ao=1110586&s=58&guid=00000186c8a4be3a9dc9a130911e27a8&src=GD_JOB_AD&t=SR&vt=w&cs=1_2b39f9a2&cb=1678403485660&jobListingId=1008508538338&cpc=ACBF47B84C432121&jrtk=3-0-1gr4a9fjejord801-1gr4a9fk4harn800-e41029a67baa7b23--6NYlbfkN0DeKde-pU_olD4YUrw_gjyRI1n-4QX0HDStiN2-PsFXQbNScsEQqavu_Pyy036DCeO6kgEebgH8Y8tCo_qWbUKWn5k5H2a6nuywPVDiZpnREM0RJiUFWea8NZrNriaPMUD5Cz70VS8CpAqByJ2ANKTvKD1StcwWCeS8xI-gcpiAJ9H4k72k6urvtdZKOTkWfxcktlRGCfeo2_4DvnZKgnTTn0uHJZ_NvVah4k94uv4EZ2ZXBzg3R0l58UNVw2tFs11YoeNyMDcst3S8wmVOUvZ31L8hDHbs89Bh9KGqm0YMnHuIfhPg7l7HBumheRLelec6IhZNlpVdgZS21yD2EgYuwrIe6E8dmyiG4Cf9p3jdgEjQHeOkDOiA6KRV3Ssow4_VP41bNiEFzPdem7HLpc13UONmD8Wn-eBP4lMF8sx4fvQX9WD21BWMKIQQbdLsvt3PL3obiVrh_o1XBrafiCYPigJW3Xlf52-8QBLAAurhhsO4g3g2dq-o_NVTCYfc2EaQP5scxx7v1gKBBK7j0TSofoPV69zo73thTqYVa2j4odobZJW_MPnjT3GGvwLQS3WYljkoctlH2CbBWs0Vxe0Cxymql_XJhiLeYCKB4Tv40Ym2h8NlfX0iyT0EkxGUrOUpNCt4fAKWT7UYzjxj77lPbqyX3xHurI2an__JpNN_Ty9Z8Mv6LqqdSehUM_GRHyKRJwcCfoX0zwY0FXwim-HEhmVTR5KFLSM%3D
Citizens,3.7,Risk Intelligence - Data Analytics Lead,"Boston, MA",NA,"Drive innovation initiatives and digital transformation within operational risk and compliance by applying Artificial Intelligence, machine learning, and automation to enhance the efficiency and effectiveness within the key areas of non-financial risk. Collaborate with stakeholders at various levels of leadership to assess needs, achieve alignment, promote “the vision”, and secure agreement on strategy and outcomes. Evaluate capabilities, recognize deficiencies and shortcomings, and establish goals to streamline roadmaps to align with overall objectives. Contribute to the definition and execution of data models, reporting, automated data systems, dashboards, and key metrics to uncover potential areas of non-compliance. Champion the utilization of advanced data analytics, predictive modeling, and statistical analysis to convert findings into impactful business results. Provide guidance and direction to a team of analytics and data science professionals, fostering their growth and development through mentoring and leadership. 10+ years of overall experience with 5+ years of leadership experience in operational and enterprise risk including use of data and analytics, to include AI and Machine Learning 5+ years of experience with relevant technologies and tools for monitoring, managing, manipulating, and drawing insights from data. Proven experience and passion for driving transformational change, influencing geographically dispersed large teams of world-class professional and in implementation of cost effective and technology enabled innovative solutions Demonstrated ability to build strong relationships with stakeholders and leading teams, both direct reports and in peer/influence models. Effectiveness in working within a large scale and complex matrix organization is essential Unwavering focus on maintaining strong risk control effectiveness while developing new data driven methods for identifying and measuring risk and improving techniques and tools Experience with defining vision, designing solutions, and communicating high level operational roadmaps and outcomes to audiences across diverse disciplines Excellent (verbal and written) communication skills in interacting with executive management, non-executives, regulators, and across several business lines and control functions Strong understanding of various Machine Learning approaches, model selection criteria and Supervised/Unsupervised learning techniques, ETL processes, reporting and visualization techniques using business intelligence and analytics tools Good working knowledge of Agile (scrum) framework Knowledge of the data pipeline and experience working with data through the various stages: identifying, validating, ingesting, monitoring, predicting, reacting, explaining Meticulous attention to detail and demonstrated ability to produce high quality, accurate work consistently Bachelor’s degree required Masters’ degree preferred",https://www.glassdoor.com/partner/jobListing.htm?pos=122&ao=1110586&s=58&guid=00000186c8a4be3a9dc9a130911e27a8&src=GD_JOB_AD&t=SR&vt=w&cs=1_408b561d&cb=1678403485661&jobListingId=1008519468668&cpc=F7A2269C793D5877&jrtk=3-0-1gr4a9fjejord801-1gr4a9fk4harn800-535b2c5882e6390c--6NYlbfkN0DbY87xTe1ZMhhjQ9k8R965brWLRw8vo5R_taDvbDEPJneDMGAgXVmb9I_qojFW15orlyhtNJ61SfVi6helJ4WJpIq0bdBlbbo9IeHEGbIWxY8jsOUxqC6itqkd9fVTV-IR6WTfq3L1hGp5hNsPn1t0aOn3PH4RyvybI4Hzc5itUrSwIhHNQqnusLtze2Aa_ZUv09VcLclokRZucgj7LPb7z4xmJ9QA6wXjkmkQOGEUwfcct9bUheT9pOnK7sSQjaljaNcnoa24Szb83BpY0YknDT-W4eYSlyGBCq3LqwrfwHzQZDZgCJNjXkyMEXBPB7iYU4DeBfAOusPDAwXlTPPa_MoPrjkc1Zvp3PqPLRWndIwiWN_AqFP8KfJ2THbQHiLRXVCfL7nMAbFwKkSNVlQepN_zyQNABaaeStgsAGCFIM_PLcR_T4kBDD4B8GF1jrgYGOsZM5uyVLtbHk8UBuRe5bJo_MoI6df_iYGH89r5YVejl_Tw0nsyQJPqr2AiyBjAU4O6XRNW0Q%3D%3D
TBD Solutions LLC,NA,Data Scientist Consultant,"Grand Rapids, MI",Employer est.:$78.75 Per Hour,Dental insurance Employee assistance program Flexible schedule Health insurance Life insurance Paid time off Retirement plan Vision insurance 8 hour shift Monday to Friday Overtime What percentage of your time would you hope includes coding and/or working with data? What about TBD Solutions and this position is specifically appealing to you? How does this position fit into your career development? Bachelor's (Required) Analysis of Healthcare Data: 2 years (Preferred) R or Python: 2 years (Preferred) Reporting writing: 2 years (Preferred) SQL: 3 years (Required),https://www.glassdoor.com/partner/jobListing.htm?pos=111&ao=1110586&s=58&guid=00000186c8a4be3a9dc9a130911e27a8&src=GD_JOB_AD&t=SR&vt=w&ea=1&cs=1_9c4c09f2&cb=1678403485660&jobListingId=1008502238053&cpc=9952A63AB06E78AD&jrtk=3-0-1gr4a9fjejord801-1gr4a9fk4harn800-88027e97e62004d0--6NYlbfkN0Ckpj9pJ7qJ3ygixlf8Zq4O57HXgoGXYFjkOTaLGVoyZ7n54bTGyHY7p4jiJK-iiA0BrX_D-usssYtvFb0zUvBXFVExVJxNHRPFH5SV0Irl4D36QrAeAvnQBwu6o92n8nIA3K9zmQK0hUan_iSJRBCXcq5vqpnVLq6wgUrXHu4vMlqbpdJQJ8DTHuZFDnAVJWLBWU_fy0TsrMYBu-M0HClrUaY7kAae-vFXUv3Ab6llKGE5L8iUN7RS2NuB4WwkWW0SuD9aO6ugEIZ3p4-1vz7G1XcaTblftpkm7upZi3r-SjxHexzyjTXtdVbmsvcCtij5QZsUaayJYjTmogzrJY2Lko1yfS_4Z-lmofQtpcxI5iXLWyKrB6E8qMLRe-L7jlke6P52J_SoqvU7RBNE-Bvzki5uWMpryPCF0aHuRasomAw0NI09D2Cfxr9Mg9_f1PItWO7hsujFsSm61XWuT2xQ7W6rnaPdV0FECtYTUbIMDz6xETnt8G5A584gpU3-Zui9Alq-vD9kWJyjJmLN7E-l0ozEdJLruRGGzLGWMCTpXBFR8MWXQZ-qNoNuuiuNJy1AKJbXtn2caNDW51OadZOb
UTHealth Houston,4.0,Research Data Scientist & Administrator III - Hybrid,"Houston, TX",Employer est.:$103K - $154K ,"100% paid medical premiums for our full-time employees Generous time off (holidays, preventative leave day, both vacation and sick time – all of which equates to around 37-38 days per year) The longer you stay, the more vacation you’ll accrue! Longevity Pay (Monthly payments after two years of service) Build your future with our awesome retirement/pension plan! Free financial and legal counseling Free mental health counseling services Gym membership discounts and access to wellness programs Other employee discounts including entertainment, car rentals, cell phones, etc. Resources for child and elder care Plus many more! Supports faculty and clinical, business and research customers with data science services on a variety of projects which may include targeted research projects, clinical analyses, hospital quality/safety assessment, health economics, , practice management, population health, and translational research. Manages multiple projects with a variety of internal and/or external team members that may or may not report directly to the position. Develops strong relationships with internal and external project sponsors or research projects. Builds models that incorporate diverse data sets representing administrative, clinical and social health indicators when applicable. Applies a variety of methods such as statistical analysis, data mining, predictive analytics, time series analysis, multivariate regression analysis, statistical process control and optimization solutions. Performs as a results-oriented problem solver to quickly synthesize complex scenarios, connect abstract patterns/information, apply appropriate methods, and implement practical and timely solutions.Demonstrates and embraces a collaborative approach to fully realize the talents of colleagues such as data stewards, IT staff, business analysts, business stakeholders and industry experts. Drafts, writes and edits research results to be submitted to peer reviewed publications and/or delivered at professional conferences.Trains and mentors researchers to develop and complete projects that contribute to the improvement of public health and health policy. Assesses the impact of computer networking and data warehousing on data use and analysis when applicable. Performs other duties as assigned. Proficiency with statistical packages, data bases and programming languages for data preparation, storage, transformation, analysis or visualization. Examples include R, SAS, STATA, SPSS, Matlab, SQL, Python, Hadoop, Pig, Hive, MapReduce, Java Tableau, Excel or other big data frameworks. Ability to work with a wide variety of data formats/sources such as relational databases, XML, JSON, CSV, text, sensors/activity trackers, clickstreams, social media, and geolocation Effective communication skills including written, oral, listening and interpersonal. PhD degree in health care, management, mathematics, engineering, informatics, or a related field 5 years of enterprise experience as a data scientist, informaticist, statistician, senior analyst or related role",https://www.glassdoor.com/partner/jobListing.htm?pos=125&ao=1110586&s=58&guid=00000186c8a4be3a9dc9a130911e27a8&src=GD_JOB_AD&t=SR&vt=w&ea=1&cs=1_5d07ffbb&cb=1678403485661&jobListingId=1008456911999&cpc=2F9DD8B511C89582&jrtk=3-0-1gr4a9fjejord801-1gr4a9fk4harn800-de98f6b1bc8d004a--6NYlbfkN0B0WYpsfFdlHnzkaod_43XUfc-xLBay7Qn_M2_P6Smr4LLRFt8BieORw1Uj8PJBoMSj6qf9QrzKqsJcj0D3elqEgmbTb9TdfHcwOLp4xUifd8vpP8hX9xqJdMckXZFmy0l_YG16dYN1tnFkQiX5Q87Gi_B6XrlOZ_35MQha4sxR6TIrwwGIBuzsfd-oPI_oA9o2_dkHsexZUn_Wk-OOyIhsSKT1jIlhsFqODsfBsG0_SqozbLMvgN9USiTggOf0fHVlU3p5HVuRnI1jQwiS_ogPQfZACFCUnTDIQTwqofyTxcCy3ANNpa_-dBNMlTjk3ZfvnlylRSEiqHa-LR99JV5E3UyR4MNeS9Y--g2sw9K_iBcC2Y3jKZqIjhNlEGjBmEaMD-BqioP_5qqXicLwf6j9wSnFI5WykRKKxJU6fkwD1XJrl50JxsPASAlEvbcYAwIzHsafF9zewY7Eddtm3GcNHa2Lu2RrHmw2EuFMM0FWCwv1z__KelMFiidETPNEPE5niAfTIkrJj4ytrqnvlffXZZdRt6W_UBu9IkYaxTc_hQG_HHEaCtXINtaMulfYw6e7cAstdWb7JemalT3pQIWY-v13SvYgHxw4wm5-E9f9jAcJqRqPBJXD
Allegheny Health Network,3.7,Data Analyst Senior,Pennsylvania,Employer est.:$23.78 Per Hour,"Collects & maintains data for reporting. Designs and maintains weekly and monthly quality scorecards. Creates and maintains data/reporting logs to support System groups. (20%)
 Understands, utilizes and educates staff on quality software for analysis, including RL Solutions, EPSI, and Cognos. (15%)
 Creates and supports innovative reporting for professional/publishable views of WPAHS quality measures. (15%)
 Responsible for submission of all quality reporting. (10%)
 Responsible for data assurance for and producing quality reporting to analyze core measures. (15%)
 Responds to all ad hoc project requests related to clinical, operational and statistical reporting. (10%)
 Supports team with interfacing of disparate systems to a centralized report writer and clinical data base warehouse to create System wide quality reporting for AHN. (15%)
 Performs other duties as assigned or required.
 Bachelor's degree in Business, Health Information Management, or a Clinical degree with experience in data development and analysis.
 Master’s degree.
 BSN degree.
 5-7 years’ data/business analysis experience. Prefer experience with EPIC or other EMR.
 Experience in clinical pathways or performance improvement.
 Required to obtain EPIC certifications Clarity, Caboodle and Cogito within 6 months of employment .
",https://www.glassdoor.com/partner/jobListing.htm?pos=120&ao=1110586&s=58&guid=00000186c8a4be3a9dc9a130911e27a8&src=GD_JOB_AD&t=SR&vt=w&cs=1_ca4d9a4e&cb=1678403485661&jobListingId=1008311456371&cpc=70D6958B2CFB98E6&jrtk=3-0-1gr4a9fjejord801-1gr4a9fk4harn800-2fcc483ae1d2e175--6NYlbfkN0CkDCxCQ_zBBGMC2k67DQ0nfCSiDkGx1VFWrdw6nWehnPJiU0-N-32EW8is8Wvm05PdkdOwUiQHuJyM7D0scVorYBBrwTpHJLMFH_qcU5FlQhVj7hFH-49afXAqUJ0fEzFWjNXXI58ZqoVbxoi-Q4R_PBB-HHT5DfUI_89Qsva1Tdvgw6Wb1m15zgNBZk697F1EzPcsbgP2uLY-_YTRixd0fffbujDoWadgImdOPgZkVaaYcCXJ4BO8_MQVhybt8LC6E-qhEGXzuKrgVihSC4gfuCWfqzKxE5uq3ZnDeXxmdO8nOsejM79rgQ72E0TY5V8Jdk4Uo0ugFysKTBQ8xRIo0DZxCAbFEJlrRslw0-XoIhFZWt86VNgzFzmROBt8LOVTUqMrfRgKSB-Oqc9JPZSLgsa4ttNuAXw3xiZ27EHeed-tkbpFiPAHfJc_68O5TGUZ-_McgbnAphqSEtzZpOyxRTjWGryO625l7aI36eT9iXXzC4ojo_f87HiTLd7HEo_6qTqXtlPW8r6Dr6xfzj3OrOxs4IXWV4O3DWfnEc5pt3Blg7YoLJZfNfjaLlAm-BVPl_HMLazo7SdwYjvKHWvm8bE3mX1s39FL0kzybY9OQgwgds97LydOz8Rc4wU9oEOi6kx4uU-HmH0BHLpfwjU9h7x6NTeeoIg3dRFeeDaHc85UcnsZ-R99SFmoIpMBBMbFGQK3axxm_I0OEb0G3h-zlGJ5LfrCHKC8JI7MdELZEg%3D%3D
Boston Children's Hospital,4.0,Natural Language Processing Research Assistant II,"Boston, MA",$42K - $54K (Glassdoor est.),"
Use machine learning approaches (e.g., natural language processing) to process clinical notes. Develop algorithms to pre-process the clinical data for development of machine learning pipelines. Develop machine learning pipelines to assist risk and outcomes prediction. 
Development of patient selection and text extraction pipelines, and development and fine tuning of negation and new entity recognition algorithms. Conduct literature searches and reviews, compiling information for journals and suggesting uses for new techniques to the P.I. Attends courses, lectures and conferences to further own knowledge of research and laboratory techniques, consulting with other researchers and technicians to exchange information. 
Assist in the process of data collection and analysis using varied instrumentation and software; provide proper documentation and organization to ensure integrity and organization of collected data. 
Apply basic statistical knowledge; understand, interpret, and describe complex data by preparing graphs and tables. 
Participate in the preparation, review, and submission of manuscripts and abstracts for publication. 
Bachelor's degree 
Experience in NLP feature engineering and modeling (e.g., text classification, entity recognition, entity extraction, question answering) 
Experience with SoTA modeling techniques (such as transformers, BERT, etc) 
Experience taking an NLP project from concept to production 
Building deep neural networks with modern tools, such as PyTorch or Tensorflow 
Expertise with Python 
One Journal publication or peer-reviewed conference paper or projects with public code repositories 
Research experience and practical knowledge of research principles is required whether through previous internship, work experience, or coursework. Experience with healthcare datasets is a plus 
Excellent critical thinking skills are required. 
Work requires the ability to communicate effectively both orally and in writing. LI",https://www.glassdoor.com/partner/jobListing.htm?pos=123&ao=1110586&s=58&guid=00000186c8a4be3a9dc9a130911e27a8&src=GD_JOB_AD&t=SR&vt=w&cs=1_7fef660c&cb=1678403485661&jobListingId=1007784538116&cpc=70E6D4E49C80165A&jrtk=3-0-1gr4a9fjejord801-1gr4a9fk4harn800-f18a9d664939d3d6--6NYlbfkN0Bhr8CzNXk_kq8VbOnaegUXV7MSXFkQREdFtn5A2jDwRArKtI5GiFp3ChOKtWnLwC_OW6vYX-cTxth2ADoFbA2dKzNxoaFfW1vg9-p0vw1bHt1G3GKsFJXl94f3iDe5arrvfxgftQQB6WuRE1zqT_PsUSjq_1V3FBu0ZlL1FYUUOrXfSJmhJ5HY7Q_2tP0GNtYKRB7U0QZzx_0_ZtJ5aJEeuoiMUiXg24w-U-AY7eug5kkavx8xF4-gTw8F9G8SK_8YrFyua25Wd1J-9rR0YUcfJQreWlOjGi2ucQ-Tdbohq3kfsNYUgoo4j9fq19LrSa60FUgh4EKx8A1kjCKBtw9R9AUbMjYvypDjOrnMdkoUCQucEj7HuwB2YcxEqvg5fKGarWHX2YzvyoO8R6ty4x795fuuXwDo4RmYnM9Zy0xEx6_dCF_OrMRXn_FhoEnwAdzQQelSq8ksUc1c-DuQ90rFj4fHuQpqVckagpk2KPk6xa1PK7j4JYVYAjM4chYUD23ybcMce9TYr6Mn5FwpvDUFuazXtTdw96k_r2HXw7E8mae0ShSYfmwkwovuuqTIfVmAzxCb4EhigWy4n9GyDI5dEgY2Zg99e5LZvBaKUif2oNuZCggVdvuw8bbkPb1v6QdAbYPqGFAmyQNxMQQ1KSUtOJMAPrIzHF8X1KKYJL5pkdShPRkT_evO2pG8V4clT7E%3D
Priority Plus Financial LLC,NA,Data Scientist,"Costa Mesa, CA",Employer est.:$106K - $114K ,"Use an ensemble of decision trees, Naive Bayes, KNN and SVM to create a unifying model. Use Dirichlet multinomial distribution to initialise the model. Perform cross-validation to check the robustness of the proposed model. Learn multi-layered perceptron using radial basis function in order to compute the posterior probability. Use Support vector machine to make predictions. 401(k) Dental insurance Employee discount Flexible spending account Health insurance Health savings account Life insurance Paid time off Vision insurance 8 hour shift Monday to Friday Bonus pay Costa Mesa, CA: Reliably commute or planning to relocate before starting work (Required) Python: 1 year (Preferred) SQL: 1 year (Preferred)",https://www.glassdoor.com/partner/jobListing.htm?pos=103&ao=1110586&s=58&guid=00000186c8a4be3a9dc9a130911e27a8&src=GD_JOB_AD&t=SR&vt=w&ea=1&cs=1_17d6753f&cb=1678403485659&jobListingId=1008519813989&cpc=545C0D17DAD7ABB7&jrtk=3-0-1gr4a9fjejord801-1gr4a9fk4harn800-7c4af0927c11718a--6NYlbfkN0Bi-g4OEguhQEx4pjzkmulzkFDPdVMQm6g82nLRMcVRUO51G8Q5x6ijh0twV98zUMPsh4HarxxBS1DecFqT-_iu_-Ngn-P7FV0POxZQumVEp-yq2hf5_l5g4uSXFfidNomeugHvKevK7QQV0g_vnhhzlelJ6N1Io0nbWIQM6X8V9_gOAx_IBgQ2BX9Ct5ImhQLW9bz_iAvoY9OAGA_ksQurG7vujNVUErpJivLHRX4A_j2tn44SGezTBDc_Uo2OLZ37fbaBFswIo6viY12xRHq_eda7VCO6K8EpqCuA4_i5viNAOlNiOAz3McU0ehdJARqY6OpmZsJkOrNvsyybohh297P65ESYPuzq40NGv53TYo-2c2y1rx9g57zpwH53W48mnzGSF_zbSLH2ZoAfSb2yfLu35Tpd7rPkla5Be994ROUQqJXkJ3srbSzaInhkHv6eBlzEf0JqLHdV1Gb5WnQz83adJuxl38NTaLeUgAYn0tKQ9d1cNpbhOTrVoKmoOxyDzcEJP3xhcmq7qYc9jVRKPrJAKvQurL5_JK3UOU8NzpE4gMd8BP3J9HhiDJWXSGNxhnsCwFtjQdKTUG_IfZFY
Inland Empire Health Plans,3.8,Data Scientist (Telecommute CA. Resident),"Rancho Cucamonga, CA",Employer est.:$126K - $160K ,"Dental insurance Employee assistance program Flexible spending account Health insurance Health savings account Life insurance Paid time off Parental leave Professional development assistance Referral program Retirement plan Tuition reimbursement Vision insurance 8 hour shift Bonus pay Rancho Cucamonga, CA 91730: Reliably commute or planning to relocate before starting work (Required) Master's (Required) Python: 4 years (Required) SAS: 4 years (Preferred) HC Domain Knowledge: 4 years (Preferred) Data Science Projects: 4 years (Preferred)",https://www.glassdoor.com/partner/jobListing.htm?pos=115&ao=1110586&s=58&guid=00000186c8a4be3a9dc9a130911e27a8&src=GD_JOB_AD&t=SR&vt=w&ea=1&cs=1_98136fe6&cb=1678403485660&jobListingId=1008134857812&cpc=AF1E4A3695F490BE&jrtk=3-0-1gr4a9fjejord801-1gr4a9fk4harn800-5cb56083b4f8aa75--6NYlbfkN0BFCX_qm-F1XnhEgluT3cIbhJuaQBpqkOVnToNFkH43A4WFbfIUri4bfGlifpEk_Ew9l8QQy3FM6kqhfwT1hP-l4U9NZt8ip2_hiUmmf6c5GV2Vvg_rYZfVn4aIeX4PL3MnTZm3OGm7uBYHhjkcFXiAs4_bp6dP-TvMDaxICUD67yITbJE81aFxeHvW0QtTD0l-KZucUsRwmz1P1sfpJs18b4RVCOqZhc7IWhdKG9U77D6dx6EkartYGpnvkImpL3Cifs2itlLEqQ-ct2ks0eurx_1EQP47MKL6g7HrdA5lwh5zaSwmJa1zVg2NWR17AjMIGdCCxMkzwA_LWehmJODVpia9E6y3SRMueg_0RM2e0j3p9sg83ytnMvrE9O5KaDbtSXyge-fKFOAFEYAyxJyWop6gAxSxSXAv33z_E5tEF_JXW1cG-bp1NZKUtEEuogIVU5r7LQ6GNEDITOFcOldwcud0PRTeuIQRJkC_EBUQqWMM1QxAreHKnnFSfPGauT0efe_B9jSBdB5Ccj_zoGaGKU7vO58ZJXdb7RvdZpodIsH15HAt8GnfvUKpxLpmeRmwsyyXKiO4RADnZ0oAq6gXWfar5WAJmt9AwBeUr6rZ7w%3D%3D
NA,NA,NA,NA,NA,NA,NA
Slim Chickens,3.7,Senior Data Analyst - Finance,"Fayetteville, AR",$64K - $91K (Glassdoor est.),401(k) 401(k) matching Dental insurance Employee discount Health insurance Paid time off Vision insurance Monday to Friday High school or equivalent (Preferred) Finance/Data Analytics: 3 years (Preferred),https://www.glassdoor.com/partner/jobListing.htm?pos=107&ao=1110586&s=58&guid=00000186c8a4be3a9dc9a130911e27a8&src=GD_JOB_AD&t=SR&vt=w&ea=1&cs=1_853be916&cb=1678403485660&jobListingId=1008428688354&cpc=75A994F6883660E9&jrtk=3-0-1gr4a9fjejord801-1gr4a9fk4harn800-e150557bba8ec2b1--6NYlbfkN0DdhE0GJ1OLpp1dBADwNsb9mCEdAPVKR2XSG2R8U4D79hucf7w9HM-mtHTLlsXyFfhXqeZvlB9QoPVwac2TGF-W1zcKjj_I3s6mLeQMNxHYf9B-BvD660j9j_l-R59Z7AvxkwS8r1mUPFK8AaFZedaYiKDWukiF1L7WCBx48W2coMRFFHXwnfOtEa5RnpE6QnuDy5SvrGoVmosjUfKnjAursSZVTugeHJP_gh9k6t7tTVaPHl2FKfPAMe-xC57DqbE0G_7-y7y4SNfL3xhr8vcp9FMns1c9X52WV_Zppt7mEP6W_aSnpfjxVg5Bf2wEWYOOeZy9IDMKdlWJ_BEKzPdi7wwHSOFfGuuS4WNu31hIEn0ltwomoSCJaiFmComhpj3nZeGx7L1svG1ers5kEYnh-rU0HjN8AsNtKGNbXzsDIYE3ocJ94BlMDD4iIm0xhnr4uJdNdkjUu8Q4Ol-MUYHfFUgXHgSWRhcIA40CcZ--W7um4NYdERDYtzpDebyB19bpZF0KhhCUl8JNp7wBLdXboyI5pDpABAW2Gp6G6eDdVM8aMMKfiWaigf051tvrvxOFtWF1WmwwjQt8tFJPNyXGe4VipdSIlh_gZiHsgmqsxg%3D%3D
