"","companyName","company_starRating","company_offeredRole","company_roleLocation","company_salary","listing_jobDesc","requested_url"
"65","American Family Insurance",3.2,"Actuarial Data Scientist II - Personal Auto (Hybrid)","Madison, WI","Employer est.:$145K ","
Explores data using a variety of statistical techniques to proactively identify relationships, creates insights and answers business questions or guides future model development 
Translates business needs into viable predictive modeling solutions and brings new and innovative ideas or approaches 
Identifies proper model structure and statistical measurement to support various hypothesis testing 
Incorporates findings and provides industry and competitor insights as part of model development and enhancement 
Writes clean and production ready code that can be easily maintained and leveraged by engineering and IT teams 
Builds and tests models and investigates areas for future improvement with minimal guidance 
Participates in Team's Agile ceremonies (sprint planning, retrospective, demo) 
Translates quantitative analyses into business friendly visuals for non-technical audience, present model findings by tailoring messages to various audiences 
Supports actuarial and state management teams in state specific model customization, filing, and roll out 
Provides sufficient model documentation 
Collaborates with IT to bring models into production 
Keeps abreast of latest relevant technologies and proposes new ones to the team 
This position requires travel up to 10% of the time. 
Demonstrated experience providing customer-driven solutions, support or service. 
Ability to work as part of a team and to communicate effectively. 
Proficiency in programming languages suitable for database access, scripting, statistical analysis, and system development. Understanding of software development best practices including source control, coding standards and testing frameworks. 
Demonstrated experience formulating, approaching, and solving complex analytical problems using a quantitative, scientific approach. 
Demonstrated experience working with large, complex datasets using big data technologies and script. 
Solid knowledge and understanding managing data to scale using data summarization, query and analysis software and tools. 
Preferred: Bachelor’s Degree in Mathematics, Statistics, Physics, Computer Sciences or Engineering, or related field or equivalent experience. Other locations and remote work may be considered.","https://www.glassdoor.com/partner/jobListing.htm?pos=308&ao=1110586&s=58&guid=00000186c8a6da6a8b3d5f366ace7dc5&src=GD_JOB_AD&t=SR&vt=w&cs=1_cd55097e&cb=1678403623985&jobListingId=1008395450104&cpc=6FDD437F7834ACD3&jrtk=3-0-1gr4admkak270801-1gr4adml1i38m800-30be2c841fa84370--6NYlbfkN0B4_0cAWFLdWJFCnfZ83J9k0zAsYiOS3g-P-TO-MQuKe6Dcoxn5lJ2xi6mnWVyINmAdsIOHVThJtd-sv_Vk6NBleKx8pEeBt86rBGnXgoulptmAhcc_P8vxqs4A3N8Flbp58-GJJjDAlddCka2mGOxy_iKFa418ulBuGX0jT0nh1VR7Op4bhmdr0pSh-JuF_G4T644GHGR04nGCPm2nlof43ZMRnDgaprWlaEIXzXn7dKS2nB1u5wtTZjuYe3cNBOY-os5A1Upm9rmzB23D8XPOZiF-Iod4c7tQ3K1yhUBOXR-2xQ8WyvUzrijXpU3r3fqEhLcnU-d3I96t6N91LvJ_CLK5Iuy1kvoKe4ETZ1XPY0bhaEOKPsiPkeE8kAAa3fSVaAz0VkzaVO7dvIarCBjW1wOVE9XMN7gPv8hwPhCTbENcWrpeT2o0F0B44nnSN6dzU8G74o28N2J7afum4NmMfR2kNqRdU-Ai_XLeOasbQR_IhqdapvcNFVT65uqdRF16uBIipWa32L2d7rnWj8BFFdVXl1lKe_xH0mufdx2fE8wriGz21I6orjdxrZdQA-sqf7IGvQ_6V2Lxvo5l_Em0KRwzZFbax_OO6UwXIK67lg6Lh-7ptxeu"
"67","Career Developers",5,"Deep Machine Learning Engineer (Expert Level Python) - 7+ years of Molecules or Proteins a must!","New York, NY","Employer est.:$200K - $550K ","Must have 7+ years of work experience to be considered for this Sr level role. Must have a Masters Degree from a top-tier US University, preferability in the Data Science space. Must have a demonstrated focus on Biochemistry This is a unique opportunity to collaborate with chemists, biologists, and computer scientists to expand the group's efforts applying machine learning to drug discovery, biomolecular simulation, and biophysics. Ideal candidates will have demonstrated expertise in developing deep learning techniques, as well as strong Python programming skills. Relevant areas of experience might include molecular dynamics, structural biology, medicinal chemistry, cheminformatics, and/or quantum chemistry.","https://www.glassdoor.com/partner/jobListing.htm?pos=328&ao=1110586&s=58&guid=00000186c8a6da6a8b3d5f366ace7dc5&src=GD_JOB_AD&t=SR&vt=w&ea=1&cs=1_96adb808&cb=1678403623987&jobListingId=1008412478459&cpc=6945AE2F4B03E059&jrtk=3-0-1gr4admkak270801-1gr4adml1i38m800-e7dbb38fa6970a2b--6NYlbfkN0AsHPWpSVJWqF-uvOoi1Tms2ACLh8AJz1YyBh03JEBOr8oDZ_kwSpvrWr64uc5eHrFLV_EU9SlcQ2-ytZo_4qewx3tSX9REb1f8SD6UdW5BMnhP2ePuABpBw0sLDT4uN_1MD41KvSwaPaA-vMvwtgDBjn8LuoL51WIx2wLkfbIz5NKnv9RIjNygnnaQnrohU-SkNsulnAUD8fmk1QL-keBfSchwi8GLo7TjwXUBsvtFhAHAi414IqcAdDXMHhSGC-U81PlUNHQ5_Mb7nmfp_mMsTSPGD38VpmFHe1PnPwY_1poQsBANnqKVFP_kedjk-KWMWUxpDeck6LVScqOOYdMoiDLkJrqIPYK0YUAwSqhm1PLfKRm_cZ5MKAU0IaVgfQ3zJY8HCid97eXJqQvtuJuTJf2LCLkf8x2DVmhBDhEU9-GNeW8YegDfWtA5_RsbTXdBlNNaOBTss0S40uxAX8gUAtarUuAmsKjWCp8CLIiEIs7rQ7wEIz1PCdr9iC5OlZbBcxJVI6eXXs4jwfutevzvtwFQ-feig75ZMf75yPRsbT79zyCIlvgXv7Js0qKDgDH_2JxgRmpfyV7m1ma-CCtgM8p_fawp4MK6VSVV-WsT7GHpS0OmmPFzQX5CqgVXmqHcsadAp2tzDx9El3_40KGwzEOd5_c3D4o8Htef-1VOJMfNhMwc2JpukWACS-SRJnPONAQ0XAgi0ZllAQbXoxFqfyw3jZlTSeMOGB7y4d9Fh-6dY7_D0sJabJfSkrhvO7H9yWU1M7xRcxWtSY6CH2Q4NEeePWKdPujwTXfvbcNN85iUeed5z-_m6iQVW35QiwvjLlTvB5f5sfzOvbKxu2FMB2xn7QNEOZSAa6Ip0eMhA1P8noNeaUSVcRBBBQIfoG_tcnAIqYpg-t9OGjJCCgiIXOYISN7QMTnGJA2p5UdgP02BZfKWv8qs8kLgKlHC1sq13i72KavltbDTL29PT6gHwUPRb9hAtXkDqMFYf6imcuXI5GLh7S3AonS7BAOdMJVBPwZSJzYXxxOg_TPJyhCSk38HXgJvthTHYZ0dOjOf4Qjhymj1YnA7z-Myxnn2ByUXZZ9k2dX2GA%3D%3D"
"68","Guidehouse",3.7,"Manager - Senior Statistician and Data Scientist","Springfield, VA","$98K - $135K (Glassdoor est.)","
US Citizenship and the ability to obtain and maintain a federal Public Trust 
EIGHT (8) years of relevant experience 
B.S./B.A. in Statistics, Mathematics, Operations Research, Computer Science, Information Systems, Engineering, Data Science, Data Analytics, or similar quantitative/computational discipline 
Experience in performing statistical analysis and modeling using R. 
Proficiency in querying data using SQL. 
Proficiency in handling and analyzing data using Excel/Access. 
Experience in developing visualizations/dashboards in Tableau/PowerBI/Qlik. 
Ability to determine and apply the appropriate analytical methods. 
Contributing as a team member: understanding personal and team roles, contributing to a positive working environment by building strong, collaborative relationships with team members. 
An ACTIVE and CURRENT SECRET federal security clearance 
M.S./M.A. in Statistics, Data Science or other field with concentration in statistical methods. 
Prior Federal Government experience 
Portfolio of statistical code for review 
Medical, Rx, Dental & Vision Insurance 
Personal and Family Sick Time & Company Paid Holidays 
Position may be eligible for a discretionary variable incentive bonus 
Parental Leave and Adoption Assistance 
401(k) Retirement Plan 
Basic Life & Supplemental Life 
Health Savings Account, Dental/Vision & Dependent Care Flexible Spending Accounts 
Short-Term & Long-Term Disability 
Student Loan PayDown 
Tuition Reimbursement, Personal Development & Learning Opportunities 
Skills Development & Certifications 
Employee Referral Program 
Corporate Sponsored Events & Community Outreach 
Emergency Back-Up Childcare Program 
Mobility Stipend","https://www.glassdoor.com/partner/jobListing.htm?pos=309&ao=1110586&s=58&guid=00000186c8a6da6a8b3d5f366ace7dc5&src=GD_JOB_AD&t=SR&vt=w&cs=1_c73d8226&cb=1678403623985&jobListingId=1008516562902&cpc=88FE657033F128A5&jrtk=3-0-1gr4admkak270801-1gr4adml1i38m800-dea176a7d9bc7d97--6NYlbfkN0DOpfXD7aCvxSiR73RUZjyy6OuclKM9Xpb799vH3iY_yH8C-PGEd0pEb8Z7LYMtRx4zqlggSV83ePPRCbr9KE68rC-tBhWW7IL_7I4MZ-XBrxO5V0TNUFK6BIoZ41J0y9T6xH6voWrjKB5V4HP1N2eds6Rk4xRinwXjSZmKMWODF5qlP3w3fULZ1YEtAz5zUnxVgRV96qtoErUmce11bdm9In3SsA1s__E4S3nSn1_8CC1vJFKSXgyf00guobJGhCtQdDKQXNMyP-ciRJKxrwcj1iSnoO7p_WlTrhJ3Xhf6a7xtzfI4fhsvGAUvPWOw2fPkLikyZzreD1tuxHHFp3vuJyF6zYNQ65sgzo1setRDiIsXjhWd5lXUuIVCFCBuoYMj-0CZu6Urg0i5G5pORgeUQKcydD7EqPme1mm7um_RPO8PNL5Vq52Jc8Nb3u3IZNuD-oXeQrpYniFin37WF8N6f9nlC5e56mkMHWzLD0LArjhQQ4Vj2q2M7Cx0nL9LTLODUeq6E4XLy6xTtAmz4hrq"
"69","Customers Bank",4.3,"Senior Data Analyst","Pennsylvania",NA,"
Perform data analysis during the project implementation to understand the data coming from the source systems to ensure all data requirements are met. 
Determine how the data can be integrated with other data in the data warehouse. 
Work with business users to educate them to properly use the new MicroStrategy self-serve tool and to understand the data. 
Meet with business users to elicit report requirements and create requirement documents. 
Perform pro-active data analysis and present the results to business leaders. 
5-7 years of Data Analysis experience 
5 years of creating report requirement documents 
Ability to write complex SQL statements 
5-7 years working in a data warehouse environment that follows an agile development process 
Experience in Financial Services including experience with Loan Servicing transactional data, data environments and an understanding of data structures and lineage 
Snowflake experience is a plus","https://www.glassdoor.com/partner/jobListing.htm?pos=310&ao=1110586&s=58&guid=00000186c8a6da6a8b3d5f366ace7dc5&src=GD_JOB_AD&t=SR&vt=w&cs=1_969124a0&cb=1678403623985&jobListingId=1008433201862&cpc=52E15D22C6AFD845&jrtk=3-0-1gr4admkak270801-1gr4adml1i38m800-b293f51335db43e0--6NYlbfkN0Db3AIdVcqnuGXnBwfx00TssvTFxp-s9YlwD-OZOJF1SIngRn4vlIwDsq2Gm9mnJOsZV_NSlDNS7ESnWoWHwkOPNQsIVqoTJWBk7hmawHI10qQc6BzeeIgcqxoftExIckJ7ByQ0Pw4wBZdGyA1u1Qc98AmrxZQTAxwxTyNs_tI_Mqny7Z9aT3ONxogVMvqM7cOb-woa2cAWGoCTH0Xr2XlO5J3HEkqiYImFiu7gABzzu7gj5dyQeVrZEYAgHO9Cq08zM0eP8gNQTJCFI8ghDYFOCBStHUDafX_hRa1V6KERe2YJ2rgWgdlDv1675PTRUPQog6CvnRoyf75Xp3Z7zLwFezzAHg9-ekjiTpalD64vvJtSXXY7-lWtl4hnK-hJdaB3JKJ5NVNNfzJhYq4QhvjWWUheLkaimvpkEnr1J-2E30QGbCkG8OuIk-G9wsRpLUHvsUJBGWCIsrwireaNsunHxSIIBQTOY-07KqoBpMJhjimU1xCnKxRj2yZ6x2CDVn-00aFI3IfVxL0OLW0naaqq6GgkIMxMrqi4I4tCZwBVh2cddbrFhof11Sai_D5t0ysVyiLHmwqEiIB5mAtB6Hf8xOTFYsZi6aoXv4PV_PKPuFNecZdYWccb8BbkjoI30et7B_-mZA8qjBbtO-xMKOX-I70lndth2zqrFAy_Vt-VVWVH_rbw500dUgPCFifYxWk%3D"
"71","Vetegrity",4.4,"Data Scientist II","Fort Meade, MD","$84K - $121K (Glassdoor est.)","Extracts meanings and value from large datasets Makes and communicates principled conclusions form data using elements of mathematics, statistics, computer science, and application specific knowledge Ability to develop and implement qualitative and quantitative methods for characterizing, exploring, and assessing large datasets in various states or organization, cleanliness, and structure account for features and limitations inherent in NSA/CSS data holdings Translates practical mission needs and analytic questions related to large datasets into technical requirements Assists others with drawing appropriate conclusions form the analysis of the performed data Effectively communicates complex technical information to non-technical audiences Makes informed recommendations regarding competing technical solutions by maintaining awareness of the constantly shifting NSA/CSS collection, processing, storage, and analytic capabilities and limitations
 Bachelor’s degree in Computer Science, Mathematics, Information Systems, Statistics, or related discipline from an accredited college or university Three (3) years’ experience as a Data Scientist in programs and contracts of similar scope, type, and complexity is required Medical/Dental/Vision 20 Days of Paid Time Off (PTO) + Federal Holidays 401k with Employer Match Profit Sharing Tuition Reimbursement
 Technology Allowance Benefit Flex Spending Account
 Life Insurance, Long & Short-Term Disability Pet Adoption Reimbursement Annual Physical Fitness/Wellness Allowance Supplemental Insurance Employee Referral Program
 Performance Incentives On-The-Spot Rewards","https://www.glassdoor.com/partner/jobListing.htm?pos=314&ao=1110586&s=58&guid=00000186c8a6da6a8b3d5f366ace7dc5&src=GD_JOB_AD&t=SR&vt=w&ea=1&cs=1_8e7fb0e8&cb=1678403623986&jobListingId=1007287814905&cpc=AB6E7ED505984E67&jrtk=3-0-1gr4admkak270801-1gr4adml1i38m800-d2173ed92ab43fb9--6NYlbfkN0D_BiQLfLZGbjFitXb5gs8KSf0yNePFj9p5EXTslCnd7krtAVYY20uDT7Cqw4dECUgE8aKYVgbMw1D8q7QZHIOBjaB7846reCblR02o8X46Js9PWE2edVbMPDQAWy_BQCF5HW6XXBT6-Nb3pmBnN6VhzxGoWKMJ-oEAf3_X7BK2UIjkuG4mJm05ieLgnrZIrfPhLjui0nl4NvKvE_1aPg-J6Q_J6ajSLILP754XeWWllj-IQAilXt1nAN1a5fkhxeae7fICZXEKvfEsW5h7yUAz24pc_HM-6bf8P6p8uNukqAbwW8jNZi42EgKK7oTgHlm6isr6Z8aTEgYuOilOJv7zZyvrD3yg-z_HQwLPlb-D3ZYV3yPyOkNcutCjuNENu9vfU1m2MJ4CCLiKKMlT16xfTyBTmJWOQ0c8wqyU1Y-h09Lc6FytK7UObuiiL3TMBO4vuj1wPpRl4_j2IdfpY7eW2GK6AV-5cbsNKyIH-jiGiwnUwwvzi6QyHa1XqkPfDv6EemzTN8C6D8dpzcJlGBB4E1AKweiAEduapH_NOUjiYFaHyI78XnMqfcs8U7jMxTj4yPl_5f0LLFFeRlkTatYStf53bd35tJJ4vpG6_kPyGPBFAdmaPaYKCFf3r5uSfJ_fl2i6ELkxJg%3D%3D"
"72","DW Simpson",4.1,"Property Casualty Rate Modeling Actuary and Data Scientist - REMOTE","Kansas City, MO","Employer est.:$177K ","Work Remote! Highly respected insurance client is in search of a Property/Casualty Rate Modeling Actuary and Data Scientist. This individual will be responsible for Rate Filing Classification Plan Analysis as well as the explanation of models and the technical issues with them. The ideal candidate would be a student actuary, ACAS, or FCAS with 5+ years of actuarial experience, including predictive analytics skills and GLM knowledge. Must have pricing/rate making experience, familiarity with SAS or R, and knowledge of advanced statistical techniques and concepts. Comp: $139-177K. (#53533)

Location:
RemoteShow more Report","https://www.glassdoor.com/partner/jobListing.htm?pos=318&ao=1110586&s=58&guid=00000186c8a6da6a8b3d5f366ace7dc5&src=GD_JOB_AD&t=SR&vt=w&cs=1_0c75bd76&cb=1678403623986&jobListingId=1008517860886&cpc=6945AE2F4B03E059&jrtk=3-0-1gr4admkak270801-1gr4adml1i38m800-2233bb95d7edaa7d--6NYlbfkN0AoyhYUseww9axZyQ0SoWsyPvXJzZBkbzhA0lVHEQx5C7_8MS7L8lCbQsioUWyRAJ3hxKnxMoPPDP8KRK8CJ3Dj1N1S6LjE5hxPG-zte8lINSdYkjs_q-1enRiqc2nySS0b0A-7sAuZDCjLJ03_rSpHIcPR7YLTI_94PDcrGMbuaKZ5K1z-J6nXY8HQU0ea6gdCPB4O29tabSeD4FAoSCXKu9G39Om5qFZwavgq0-wEZmOUr0PTiMEJ8mWKAx1xYBQibcudoGghxGhvIZ8VqaY8MTzmhOruT4p0eeXMvbI8uv3xwSUS65CeBZk-ZyylUIQINjxbJU9PIybwud5mNvuBWUHZ1z2dM9WrKbb9vfIF4iE2ROYxg4LyRhPa6xeang26TSdgi-eF-LucaTwr8rDRt_nonmsVypHXk5GRqlqp7iBeKPZCc2ngz6l1-xwLPBrxn7hUkSXGyZ_49BH1oHBfqcg16XuLQpAgjWjOm4kNHARzwNzRlYvDQwzhw-1iGSFGucwIp9PIV0flXe9jphl5pQGIXGhS4sHHNeFCmlcYfFtyGi16DuOfuk_GQjGVzuKzi6rxhvn3vPvurWgI2Qq7Xr8Jv1upIbWdDPaQhhBLCeuHJE16fR0Uj0rc3zAaI3Y%3D"
"73","Carpenter Technology",2.8,"Associate Data Scientist","Raleigh, NC",NA,"
Apply data science techniques to massive structured / unstructured data sets across multiple environments in order to discover patterns and solve strategic / tactical business problems – process improvement, yield improvement, and product development. 
Build statistical and machine learning models for detecting root causes in process and yield variability. Machine learning algorithms will be exercised are – Logit, probit, complementary log-log regression, Random Forest, GBMs such as XGBoost, AdaBoost, CatBoost, LightGBM, RusBoost, AveBoost, ORBoost, SMOTEBoost, etc., Support Vector Machines, KNNs, MLP Neural Net, Convolutional Neural Net. Statistical models will be exercised are – General Linear Model, Generalized Linear Model, Multivariate Regression, Survival Models, Stepwise Logistic Regression, and Non-Parametric Models. 
Develop prescriptions with actionable and controllable recipes for critical process variables from model parameters with baseline performance and estimated performance upon implementation of model prescriptions. 
Design and conduct experiment for observational data to identify the factors associated with cost of poor quality and process variability – Randomized, Randomized Block, Latin Square, and Full factorial and apply appropriate general linear models such as Fixed effect, Random Effect, Mixed Effect Models to derive ANOVA, ANCOVA, MANOVA, and MANCOVA. 
Build process simulation model to identify optimal critical process path using both chaotic dynamic and stochastic process simulation such as Hidden Gauss-Markov and Monte-Carlo Simulation. 
Develop anomaly detection models such as iForest, Local Outlier Factor, GMM, one class SVM, etc. to identify anomalous behavior in critical process inputs for both batch and stream processing. 
Manage machine learning model life cycle through documentation, version control, model presentation, model audit, back testing, forward testing, benchmarking with the help of performance metrics. 
Communicate and democratize model findings very clearly and precisely with stakeholders such as market leads, metallurgists, R&D and senior business leaders. 
Drive the collection, cleansing, processing, and analysis of new and existing data sources 
Report findings through appropriate outputs and visualizations tailored for the intended audiences 
Learn and stay current on analytics developments in one or more business domains: Internet of Things, Manufacturing, Supply Chain, Forecasting, Marketing and Sales, Pricing, etc. 
Learn and stay current on developments in one or more analytics domains: Operations Research, Machine Learning, Deep Learning / AI, Simulation, etc. 
Generate innovative ideas, establish new research directions, and shape the information strategy in support of technical projects and new product developments 
Collaborate with new, cross-functional teams on accelerated projects to scale data architecture, build digital products, and execute data science solutions 
Perform all other duties and special projects as assigned. 
BA in computer science, mathematics, statistics, operations research or related field required. MS/PhD preferred. 
0-3 years of experience in data science, analytics, and model building roles. 
Experienced in programming in Python, R, Julia, MATLAB and SAS. 
Knowledge of other programming languages and analysis tools (e.g. Scala, Java, Ruby, JavaScript, shell scripting). 
Experience using big data frameworks and tools (e.g. Hadoop, Spark, MapReduce, Hive, Pig, Luigi/Airflow, Kafka, Data streaming, NoSQL, SQL). 
Familiarity with cloud-based solutions (e.g. Azure, AWS EMR). 
Knowledge of analytical techniques and methodologies (e.g. machine learning, segmentation, mix and time series modeling, response modeling, lift modeling, experimental design, neural networks, data mining, optimization techniques). 
Experience with data profiling and data cleansing techniques. 
Deep working knowledge and experience in probability theory, linear programing, and optimization 
1-3 years of experience on statistical inference, predictive modeling, and machine learning 
Strong programing skills in Python, SQL, SAS, and R 
Working experience on data visualization tools such as PowerBI and Tableau 
Excellent communication skills while communicating with data to business leaders 
Strong written and verbal communication skills, including all levels within the organization. 
Strong collaboration skills and comfortable working in a team environment. 
Self-motivated with the ability to prioritize, meet deadlines and manage changing priorities. 
Proven ability to be flexible and work hard, both independently, in a team environment and under direct supervision. 
Possess beginning / working knowledge of subject matter. 
Natural curiosity and passion for empirical research and problem solving.","https://www.glassdoor.com/partner/jobListing.htm?pos=315&ao=1110586&s=58&guid=00000186c8a6da6a8b3d5f366ace7dc5&src=GD_JOB_AD&t=SR&vt=w&cs=1_71666c39&cb=1678403623985&jobListingId=1007957430824&cpc=9C938E8DE9AD6C02&jrtk=3-0-1gr4admkak270801-1gr4adml1i38m800-a2b00ef69fd2188d--6NYlbfkN0DH7kO-9Ps_LVp3TinX8KqHXlrSwFZAly3CJobc-kesv4YrknSVBPMjWwZ5piK6phPkStzSQVQvFK94vSTFlunNb8GETnIUhE-3m_jTh3k5233K9eRjtUC5dqj0Qlsp4DW6W3mXsdMK7Jt2QHK25AaZ_iI3sSpz_tDJROkS0hO8Tzus8Pu1F5LJvO7OkxcMVuOMhJK4UGpkNNcAeK5CD2IS6QZ7D2lPMvfGbmhg5ou2FGJWPg5lInTwuN9xvCoONM1HCZ14-YD9HqAFYhQSrx6uLZCBoI41HH4BW2aB_7XMxA9OiivfP_uco5Gj_c-e763NMVnJgRWX_bHcUjgiGR_OVNqB63TrAlTc6zr6OH6A3s5IQ-aj4d6TjAGhf3M-CRJRb94ZDWstErZcDzkpvAdWwSEqcod8QR67RPclrx7tieECik1igKvfHdcH0ThiR7Zt2O7EsrKEbQ_ogvUAhTuoYEIdnoXFAL1lF2w5AKmI4-3cPOczAMATl3pvRzDpscjUavV2r8bkzyQXZ8r2HU1l71VlvpKjwWGJzFBvvYLERjrEtEPTCjkTX6TkzBzUwmj3BPwtE9s8GTPVjDdlhD1zsCSyvfVLVhXt9ZsJnr8bGrjM8d7n7CcM-_J0ITw8Hwo%3D"
"74","KBR",3.9,"Data Scientist Hiring Event","Colorado Springs, CO","Employer est.:$120K - $179K ","Colorado Springs, CO - 100% On Site Active TS/SCI or Active TS with T5/SSBI within last two years. BS degree in Computer Science, Mathematics, Statistics or Data Science. Other degrees will be considered with relevant work experience. Experience with programming (scripting) languages (i.e. Bash, Python, .Net or Java) Apache open-source products (i.e. NiFi, Kafka, Zookeeper, Spark) Experience as a Data Scientist/Engineer supporting single or multiple domain areas Knowledge of advanced statistical techniques and concepts A drive to learn and master new technologies SQL or NoSQL Experience as a formal instructor, teacher or tutor Experience in Space, ISR, Cyber or SOF Experience leading projects w/ up to 5 team members Knowledge of SAFe agile processes Linux System Administrator Algorithm development experience Software development experience (i.e. C++, Java, C) Experience with IC, USSF, USAF or other DOD entities Experience working with any intelligence disciplines (i.e. SIGINT, OSINT, MASINT, GEOINT, HUMINT) Kubernetes / Docker Experience w/ Apache Accumulo Git/GitLab experience Experience with XML Schemas Resume","https://www.glassdoor.com/partner/jobListing.htm?pos=302&ao=1110586&s=58&guid=00000186c8a6da6a8b3d5f366ace7dc5&src=GD_JOB_AD&t=SR&vt=w&cs=1_4cb32d47&cb=1678403623984&jobListingId=1008505500174&cpc=88825F42635DFB7C&jrtk=3-0-1gr4admkak270801-1gr4adml1i38m800-8a80b2084be2ab40--6NYlbfkN0Btxs39KmTzjw_u_hUXcyTcLpNeUj18C2Nw5A7DCW0FWLmBkNbeW67PGkrXbWdbrsZrHef7MTWGx8e10TuRDFlwk1od1gtzFEjIZtLcpvxvNMjzH9N50-L156UpXSOehBEYWmKl4ZHq-9Z9XTk-MayeicnFF-YalnR8Wt9vrMpfEwgP-sxVhEJwfjPqDEEUGjdmvXArzG8CBnzComns1Y0AhOOsbSfguKCsppLkqYNZLkx6k4Q_tliBKUr-M_HRLUmk-XKdTIvvGlBlQjsDyQUADOwIfa7fceComt5pF_8i5sJXJAHpuCyhUU4MvPU1tBJ67sEX_FJa4sMBaMFQI1db-b3q-cMHcaWxvCpVh5lG8W7ba6n5_ANQsSYemcxRRKE4xVxRviK1ukzTkKgZnMlta5OTY-9NFXWNcZbXUooJPFN7Y4KOFbwlyiiTqQzKOtuENQQ-5NRstTF0aLdgklQTJS9TaQGpJ16yTDUoNR6N-4a2F0pk56UD_myTvrFAgRSYzMRCYmA4XShMx3NC-olNgLeNhwDs9GrzKMTpTtPfDB6tPcari2BrCGH5dq97GdOdICqXqjPYYKblIxPj1rvQBQ2vuXKaim_-_JY6xgMO-1YYO5nU89FccRlPicxc6qP4hiWZ8fCPJNyCrhPx6s3tSeKModg6mSjYyBF3tPqCSfEUXFP3S3PuF30qvSjvArL-XP7-9dxQSe5V_I1dRd9jEChJOOrMHS3AgrYpyt1O7qz_amK8FB-s86yD9W2HbDhoNMIyERmCn2QaHRXi_vwyE2EgynIHd3M8dswSL-38ZIVNWJlsIVlOHrBcd1ISFjyfJ_mgMMIw9g%3D%3D"
