"","companyName","company_starRating","company_offeredRole","company_roleLocation","company_salary","listing_jobDesc","requested_url"
"9","Metropolitan Transportation Authority",3.6,"Cybersecurity Analyst Levels 1-7, Data Scientist","Manhattan",NA,"Designs Machine Learning solutions for cybersecurity problems Designs Deep Learning algorithms and methods
 Develops experiments to compensate for system limitations and transforms them into long term solutions Optimizes, validates, and monitors model training Administer data science software components Create algorithms for detecting anomalies Formulate Key Performance Indicators for a Security Operations Center Researching emerging threats and vulnerabilities to aid in the identification of network incidents, and supports the creation of new architecture, policies, standards, and guidance to address them Provide incident response support, including mitigating actions to contain activity and facilitating forensics analysis when necessary Conducts security monitoring and intrusion detection analysis using various technology and analytic tools, such as web and next generation firewalls, machine and human behavior learning tools, host-based security system, security event and incident monitoring systems, virtual, physical, and cloud platforms, user endpoint (laptop, desktop, mobile, and internet of things/IOT) systems, etc. Correlates events and activities across systems to identify trends of unauthorized use Reviews alerts and data from sensors and documents formal, technical incident reports Tests new systems and manage cybersecurity risks and remediation through analysis Responds to computer security incidents according to the computer security incident response policy and procedures Provides technical guidance to first responders for handling information security incidents Provides timely and relevant updates to appropriate stakeholders and decision makers Communicates investigation findings to relevant business units to help improve the information security posture Validates and maintains incident response plans and processes to address potential threats Compiles and analyzes data for management reporting and metrics Monitors relevant information sources to stay up to date on current attacks and trends Analyzes potential impact of new threats and communicates risks back to detection engineering functions Performs root-cause analysis to document findings, and participate in root-cause elimination activities as required Works with data sets to identify patterns Understands data automation and analysis techniques Uses judgment to form conclusions that may challenge conventional wisdom Hypothesizes new threats and indicators of compromise Monitors threat intelligence feeds to identify a range of threats, including indicators of compromise and advanced persistent threats (APTs) Identifies the tactics, techniques, and procedures (TTPs) of potential threats through the MITRE ATT&CK or similar frameworks Participate in the creation of enterprise security documents (policies, standards, baselines, guidelines, and procedures) under the direction of the IT Security Manager, where appropriate. Perform Contract management and supply management functions appropriate to reduce security risks Analysis of large-scale data that is both structured and unstructured Performs proactive research on cybersecurity threats and risks Reports on KPIs for existing cybersecurity stack Utilize SIEM to detect key patterns and heuristic anomalies
 Designs scripts in a variety of languages including Python, SQL, numpy, pandas, MATLAB, etc.
 Performs basic analysis while following established procedures to ensure security of systems, contractor, and/or process. Assists in executing tests and reporting on system security parameters to support security of system, contractor, and/or vendor. Performs basic troubleshooting and escalates issues as appropriate to ensure effective resolution of security baseline deviations and risks. Reviews and correlates system logs and provides support Participates on project teams, providing information and documentation and executing well defined changes under guidance to ensure the infrastructure meets organization needs Create and design rich visualizations through data analysis & interpretation Collaborate with Purple team to assist in designing cybersecurity solutions to compensate for lack of technology capabilities Utilize REST APIs Utilize statistical analysis tools such as Python, R, SAS, etc to analyze trending attack statistics Assess current tools and database limitations Determine logging gaps and provide recommendations for log ingestion Develop automated reports to proactively detect cybersecurity incidents through predictive modeling Develop technical documentation and reports Identify gaps in data log ingestion Identify logs that can be reduced or filtered out Provides routine analysis on assigned technologies, following established procedures to ensure safety and security of systems, vendor performance, or processes. Reviews and correlates system logs to identify potential cybersecurity and technical issues. Implements new data integrations across existing technologies Visualization of metrics through dynamic dashboards such as Power BI for operational analysis Perform pattern analysis on threat actor methodologies and provide recommendations for threat hunting efforts Performs analysis on SOC escalations and provides recommendations to address trending attack / incident trends Extract and manipulate large datasets with platforms such as Hadoop, Oracle, etc in support of Incident Response functions Develop & maintain protocols for handling, processing, and cleaning data Design data science procedures and policies in alignment with industry best practices Algorithm design for insider threat detection Support various MTA project managers in understanding the focus of their analytical needs and develop actionable insights to support their operational areas. Provides proactive monitoring and analysis for a domain of the cybersecurity to ensure systems security baseline targets are met. Implements changes to one or more cybersecurity related domain technologies, executing tests and reporting on security baselines, violations/anomalies, to meet requested needs. Troubleshoot and investigate cybersecurity incidents and issues by analyzing a chain of events and applying technical knowledge following established procedures and standards to resolve immediate customer needs. Maintains and updates existing documentation and standard operating procedures to ensure accurate and timely information is available for assigned systems.
 Works with more experienced colleagues and other IT technical resources to improve coordination of cybersecurity requirements and analyze issues as they arise Participate in the evaluation of new products and technologies, under the direction and guidance of senior colleagues, relevant to assigned cybersecurity area to enhance cybersecurity posture and reduce risk to the MTA while achieving objectives. Work with existing machine-learning and other data scientists to finetune and modify existing algorithms to support business requirements Technical writing and documentation; ability to present findings to both technical and non-technical audiences Utilize threat intelligence to perform large-scale data analysis of dark web information Develop unsupervised anomaly detection for a variety of cybersecurity technologies including but not limited to IAMS, EDR, Email Security, Firewalls, Proxies, etc.
 Prioritize data collection, feedback loops, and other requirements for future projects Executes to the defined product lifecycle, manages the product lifecycle for a component of the infrastructure, proposes changes for implementation, gathers data and analyzes capacity and performance to assure operational availability. Analyzes the current state of the infrastructure and identifies opportunities for improvement to ensure systems meet business needs. Contributes to changes to established roadmaps, documents them effectively and executes the implementation of changes in their area(s) of responsibility. Provides ongoing support and troubleshooting for installed technical solutions by analyzing a chain of events and applying technical knowledge, following established procedures and standards to resolve immediate customer needs.
 Investigates, evaluates, and tests new products and technologies relevant to assigned infrastructure subsets to enhance cybersecurity analytics and overall security posture. Implements and/or supports the implementation of new technologies for their area of the cybersecurity that affects infrastructure, applications and/or processes. Promotes security standards and supports efforts to expand and migrate to future security architecture to improve security and share learning. Develop and lead large quantitative projects Support threat intelligence partners in the education and design of a Data Science program Design server-level automation for a variety of operating systems Interface with C-level IT leadership in relaying threat landscape trends & patterns backed by statistical analysis Apply Exploratory Data Analysis (EDA) to general IT & OT systems that support transportation / critical infrastructure Provides more advanced analytical capability in several security domains.
 Adds new components to a roadmap, documents them effectively, and directs the testing and implementation of changes. When provided with an objective to improve security in their security domain(s) and related technology, develops and implements action plans needed to effect the change. Research new technologies/products and their impact on the infrastructure, prepares a preliminary evaluation of technologies/products and associated costs, and develops and presents recommendations to support anticipated future business needs. Receives security and performance data and analyzes the baselines and efficacy of installed technologies. Proposes and implements any required changes, including identifying and planning for any resulting impacts on other technologies to optimize system availability and continuity. Provides ongoing support and troubleshooting for incidents, correlations and reporting to more junior analysts to resolve immediate security threats and/or customer needs.
 Provides technical leadership to project teams in their area of expertise and/or leads teams to complete projects specific to their area(s) of expertise to maximize and share learning.
 Provides guidance and technical coaching to less experienced staff to support effective workflow and develop technical talent. Provides subject matter expertise in scripting and coding solutions to complex problems Evaluate software packages and open-source environments for cybersecurity hygiene
 Deploy models to the cloud and develop frameworks for automation in the cloud
 Design solutions for monitoring operational technologies spanning a wide range of functions such as Hydraulics, Fan Plants, Ventilation, CBTC, Signals, etc. Serves as a technical resource for multiple components of the security architecture, risk analysis, and analytics to help define the problems and identify remediation strategies for them.
 Troubleshoots and analyzes most problems within assigned area(s), providing cybersecurity correlation, expertise, and resolution that may be complicated by technology interdependency and challenging security issues Participates in planning for the future technical architecture, providing insight into the future of their area of technology in order to continually improve effectiveness and efficiency. Participates in or leads the development of roadmaps related to their area(s) of expertise to manage and meet identified technology needs. Participates in the evaluation of new technologies relative to their domain(s) to determine applicability to and best meet the needs of MTA and constituent agencies.
 Specifies the monitoring points to assess performance of technologies in their domain(s). Recommends the necessary actions to ensure optimal performance and reliability. Develops disaster recovery and contingency plans for their domain(s) to provide users with minimal interruptions in service.
 Provides technical leadership to project teams in their area of expertise to promote technical understanding and talent development and/or leads teams to complete projects when a project manager has not been assigned.
 Contributes to the technical elements of RFPs and RFIs and negotiates with vendors on technical issues to ensure results are delivered in line with user and organization requirements. Interacts with major providers at the technical expert level to address mission critical issues, evaluates ongoing vendor service level and enforces SLAs and penalties. Proactively identifies and addresses data analytical shortcomings Performs briefings for all levels of MTA leadership to drive executive focus Assesses overall current cybersecurity maturity and develops analytical insights into risk management
 Acts as a technical resource for multiple technologies, with vast knowledge of the capabilities and constraints of technologies supported to continually improve system effectiveness and efficiency.
 Demonstrates a strong understanding of the current and future technology architecture, including the inter-operability of technologies to effectively integrate MTA systems and support the long-term strategies of the business.
 Provides expert level guidance and training to the IT community to maximize and share learning. Analyzes cross-technology/platform issues and addresses problems factoring in an understanding of the current and future architectures to ensure optimal performance and reliability across systems.
 Leads the evaluation of new technologies relative to their domain(s) to determine applicability to and best meet the needs of MTA and constituent agencies. Proposes technology investments supported by a thorough technical analysis and business case. Develops disaster recovery and contingency plans for their domain(s) to provide users with minimal interruptions in service.
 Creates complete RFPs and RFIs and negotiates contract terms and conditions with vendors and procurement in consideration of the needs of the business. Interacts with major providers at the technical expert level to address mission critical issues, evaluates ongoing vendor service level and enforces SLAs and penalties. Establishes systems to monitor compliance with architectural standards and to ensure technical integrity. Associate degree in Computer Science or related fields. An equivalent combination of education and experience may be considered in lieu of a degree.
 Basic knowledge and familiarity with monitoring, installing, maintaining and/or troubleshooting cybersecurity related issues associated with applications and/or infrastructure systems
 Understanding of TCP/IP (OSI Layers 1– 4) and Internet and Intranet technologies required (OSI Layers 5-7) required. Understanding of Operating Systems Scripting or programming skills (PERL, Python, PowerShell, etc.) preferred as needed Associate degree in Computer Science or related fields. An equivalent combination of education and experience may be considered in lieu of a degree and 2+ years of relevant experience, or a bachelor’s degree in Computer Science or related fields.
 Basic knowledge and familiarity with installing, maintaining and troubleshooting technology systems. Proven ability to troubleshoot and support technical issues. Proven ability to analyze a security risk assessment Understanding of Operating Systems Understanding of TCP/IP (OSI Layers 1– 4) and Internet and Intranet technologies required (OSI Layers 5-7) required. Scripting or programming skills (PERL, Python, PowerShell, etc.) preferred as needed. 6 months of experience in a specific (Cloud, Applications, Infrastructure, Security Technology, etc.) cybersecurity domain is preferred Bachelor’s Degree in Computer Science or related fields. An equivalent combination of education and experience may be considered in lieu of a degree.
 CISSP or other advanced security-related certification preferred but not required. Certifications in technology subdomains preferred but not required (ie. Cloud, Applications, Infrastructure, Security Technology, etc.) 2+ years of relevant experience. Requires prior experience with installing, maintaining and troubleshooting technology systems. Proven ability to troubleshoot and support technical issues using standardized procedures. Proven ability to analyze a security risk assessment or conduct one with guidance Understanding of Operating Systems and Hardware Understanding of TCP/IP (OSI Layers 1– 4) and Internet and Intranet technologies required (OSI Layers 5-7) required. Scripting or programming skills (PERL, Python, PowerShell, etc.) preferred as needed. 1 year of experience in a specific (Cloud, Applications, Infrastructure, Security Technology, etc.) cybersecurity subdomain is preferred Bachelor’s Degree in Computer Science or related fields. An equivalent combination of education and experience may be considered in lieu of a degree. 3+ years of relevant experience or 18 months of experience in a specific cybersecurity subdomain (Cloud, Applications, Infrastructure, Security Technology, etc.).
 Current CISSP or other advanced security-related certification preferred but not required. Certifications in technology subdomains preferred but not required (ie. Cloud, Applications, Infrastructure, Security Technology, etc.) Proven ability to independently evaluate and resolve most problems within an area of infrastructure, applications within a security domain context. Proven ability to analyze and/or conduct a security risk assessment Understanding of Operating Systems and Hardware Advanced understanding of TCP/IP (OSI Layers 1– 4) and Internet and Intranet technologies required (OSI Layers 5-7) required. Scripting or programming skills (PERL, Python, PowerShell, etc.). Bachelor’s Degree in Computer Science or related fields. An equivalent combination of education and experience may be considered in lieu of a degree. Progressive cybersecurity related accomplishments Requires broad technical knowledge of multiple technologies, or an in-depth knowledge of one technology including its impact on other technologies. Proven ability to analyze and/or conduct a security risk assessment Understanding of Operating Systems and Hardware Advanced understanding of TCP/IP (OSI Layers 1– 4) and Internet and Intranet technologies required (OSI Layers 5-7) required. Scripting or programming skills (PERL, Python, PowerShell, etc.) as needed. Bachelor’s Degree in Computer Science or related fields. An equivalent combination of education and experience may be considered in lieu of a degree.
 8+ years of relevant experience or 4 years of experience in a specific cybersecurity subdomain (Cloud, Applications, Infrastructure, Security Technology, etc.).
 CISSP or other advanced security-related certification preferred
 Certifications in technology subdomains preferred (ie. Cloud, Applications, Infrastructure, Security Technology, etc.). Verifiable implementation of security domain controls for enterprise technologies Requires seasoned expertise in multiple technologies and strong understanding of the current and future technology architecture, including the inter-operability of technologies. Advanced ability to conduct and analyze a security risk assessment Understanding of Operating Systems and Hardware Expert understanding of TCP/IP (OSI Layers 1– 4) and Internet and Intranet technologies required (OSI Layers 5-7) required. Some scripting or programming skills (PERL, Python, PowerShell, etc.) as needed. Bachelor’s Degree in Computer Science or related fields. An equivalent combination of education and experience may be considered in lieu of a degree.
 10+ years of relevant technology based or cybersecurity experience or 5 years of experience in a specific cybersecurity subdomain (Cloud, Applications, Infrastructure, Security Technology, etc.). CISSP and other advanced security-related certification preferred.
 Certifications in technology subdomains preferred (ie. Cloud, Applications, Infrastructure, Security Technology, etc.). Significant practical expertise in cybersecurity related disciplines. Requires seasoned expertise in multiple security domains, technologies and strong understanding of the current and future technology and security architecture, including the inter-operability of security solutions and technologies.
 Requires proven track record of successful implementation of architectural designs. Expert ability to conduct and analyze a security risk assessment Advanced understanding of Operating Systems and Hardware Expert understanding of TCP/IP (OSI Layers 1– 4) and Internet and Intranet technologies required (OSI Layers 5-7) required. Some scripting or programming skills (PERL, Python, PowerShell, etc.) as needed","https://www.glassdoor.com/partner/jobListing.htm?pos=113&ao=1110586&s=58&guid=00000186c8a4be3a9dc9a130911e27a8&src=GD_JOB_AD&t=SR&vt=w&cs=1_7fc1b4b4&cb=1678403485660&jobListingId=1008359249694&cpc=853DEF62E69EE75B&jrtk=3-0-1gr4a9fjejord801-1gr4a9fk4harn800-5afae650daa347cc--6NYlbfkN0CQjGBvBzxy8B4utFrgaY1ny7GkPzahpSOLjyaRgOrRoeNLSQ3Yh1Y9EYo3noXyziNZe5DqG_12KTVB4ulGBEypTnrGz1i8CzY3Exesekd7i9huPSoYVEbLXudV0TNAssRoXK9zAP8B-zmygLNkIq-t6LvNCDBihKrjADCw4UUN_qrxaXWwBmHSihgmTnUT-VyTZ1iC-huS6utY4eVXIzG6WKU-yqf4JoUcpzGf2wTIgrlsBQzyrxZD-qwNGNN8ieECnU0fuz4rbvE35NYKtwEBGA8N4ziCLs42MXEmY3YDdRoESaNU-QLNDGObeJp8HslNdJiMQNNRPfHRAfQgXKw1krOK0l_iE_4PbMW9i6AyrZm8Tjon2Xt68fmTL_Fzw1EE3vyQQ3aWuhG3zJQjHuqRtGjTQqfZf9YVDU-nmHShJZMNhwtg_gh8Ufi4zrwainfjHQpODq2y-F3vYi3rhKNqPMQZIm3sb_y7srBUYC7n5jwHGuYeYcyjp5Q8RILRgTBeC5XtQ4mYJRfDjbhmScI-a-AWCqFngI45DJXSf49cLnfsyf1shBAxKvLW2X0u3w0AVBJcInlE3KELRK3OUmutNBk6hIfBwLlZ4zZZI1OcS9meUadTIT0iLPOQOEOmiBzDaQp9ze_Hz07lNf5LLIv_JRjBb2kSsshxrPSjy4gASmbphEaM2Lhi_VhlQfaSmVeo0wfDlKUv3GqW13vwjPU4e7R-LxF4Pck3Thfk70qVSfZGtQvov5Ll"
"10","Belcan Government Services",3.7,"Data Scientist *Must hold active TS/SCI*","Tampa, FL","Employer est.:$130K ","The DSE is responsible for preparing ""big data infrastructure to include the design, build, and integration of various data sources. The contractor shall perform the following tasks:Develop complex queries to ensure accessibility while optimizing the performance of NoSQL and or big data infrastructure. US Citizen Data Visualization experience preferred. 401(k) 401(k) matching Dental insurance Health insurance Paid time off Vision insurance 8 hour shift Monday to Friday Tampa, FL: Reliably commute or planning to relocate before starting work (Required) Python: 1 year (Preferred) SQL: 1 year (Preferred)","https://www.glassdoor.com/partner/jobListing.htm?pos=101&ao=1110586&s=58&guid=00000186c8a4be3a9dc9a130911e27a8&src=GD_JOB_AD&t=SR&vt=w&ea=1&cs=1_d21c1360&cb=1678403485659&jobListingId=1008490150623&cpc=6BDFADFCA66887C5&jrtk=3-0-1gr4a9fjejord801-1gr4a9fk4harn800-92fb22c05179d948--6NYlbfkN0DRu0heF5eTsWSUDnkZoxPvJz6zyL_N1Crl-Ylj_C196zA8pcp8meR-hAxBwHLyynVItUUn9VCRK8ByBRagv5NvlOm4gRebdxdvbLsxmCTHLQaTbX2MwZNc1LnvQF3QfYbCoft9dn86SdC-QwRwvB1_aKYvQlr9oNGVZAlthip639xihMqffh3CrccCVYTrqSxZ5exumerathU_5r3Xu0EL54gCuubwauXbvXq7rfE9A1CpfKQB6Av5X9F7wdHHVpF4XA6pcOH6Yfk06dJDLwn044qLr1p4lnsNY4PuIwm3PINjz7c8-W7IMvZe7VVzaZGyR9giQQKnPgUj75Kbj0a_8K0ZwOw2o-WJrcaZr0dnmfzdHpskTkoZmaKqJh0qlGhlF3h2nwEzcrk7terN5cKDKcHYenc3f_DVEvcT3EzMyHY15TLwP5J1CgKEzA8Sr53lg_Kn-O_IIPRFGlewS3SsXAtJNZANY6b2mt2dbYmX7vYQ3u_vGEMT8paKdbE-saps3ur-iXbHY8FuiZ-G7qyZOGkN8Lnp_BKmt6dOUXiUYiP0E46_WvQNXyqaYKf2jr6MDbsOo6i9U5jksLqbFytqbUHp28ZJV3zVqJa6FJOgaQ%3D%3D"
